Solution_ID,Text
2,"Installation frigorifique négative de type cascade utilisant du CO2, Centrale froid, Froid, Utilités"
3,"Centrale négative en mode booster, Centrale froid, Froid, Utilités"
4,"Arrêt des compresseurs le week end et lorsque le besoin de refroidissement est nul, Ajustement production/besoin, Froid, Utilités"
5,"Régulation non électronique sur un compresseur, Régulation, Froid, Utilités"
6,"Condenseur frigorifique à haute efficacité, Condenseur, Froid, Utilités"
7,"Condenseur surélevée pour garantir un bon échange thermique, Condenseur, Froid, Utilités"
8,"Vérification du dimensionnement et remplacement des compresseurs surdimensionnés si nécessaire., Centrale froid, Froid, Utilités"
9,"Zone neutre entre les températures de consignes chaude et froide, Gestion et pilotage, Froid, Utilités"
10,"Séparation des productions de froid, Evaporateur, Froid, Utilités"
11,"Diminution des entrées de chaleur dans les zones d'utilisation du froid, Chambre froide, Froid, Utilités"
12,"Pré-refroidissement du produit, Gestion et pilotage, Froid, Utilités"
13,"Meuble frigorifique de type vertical avec uniquement éclairage en fronton, Meuble frigorifique, Froid, Utilités"
14,"Rideaux de nuit sur meubles frigorifiques de type vertical à température positive, Meuble frigorifique, Froid, Utilités"
15,"Porte non chauffante à haute performance d'isolation pour armoire verticale à froid négatif, Meuble frigorifique, Froid, Utilités"
16,"Séparation du dégivrage d'un meuble frigorifique en plusieurs parties, Meuble frigorifique, Froid, Utilités"
17,"Stockage thermique, Stockage, Froid, Utilités"
18,"Free cooling par tour à vent, Climatisation, CVC, Bâtiment"
19,"Free chilling d'un réseau d'eau glacée, Condenseur, Froid, Utilités"
20,"Rafraichissement solaire, Climatisation, CVC, Bâtiment"
21,"Contrôle de l'état du calorifugeage du circuit froid et réparer si nécessaire., Maintenance, Froid, Utilités"
22,"Vérification et remplacement du calorifugeage des chambres froides, Chambre froide, Froid, Utilités"
23,"Diminution des distances de tuyauteries, Réseau, Froid, Utilités"
24,"Programme de maintenance performant, Maintenance, Froid, Utilités"
25,"Optimisation des dégivrages des évaporateurs, Evaporateur, Froid, Utilités"
26,"Ecart de température optimisé à l'évaporateur, Evaporateur, Froid, Utilités"
27,"Contrôle du traitement de l'eau des condenseurs de type évaporatif et des tours de refroidissement, Maintenance, Froid, Utilités"
28,"Ecart de température optimisé au condenseur, Condenseur, Froid, Utilités"
29,"Nettoyage des condenseurs et autres échangeurs, Condenseur, Froid, Utilités"
30,"Alimentation correcte en air du condenseur, Condenseur, Froid, Utilités"
31,"Purge règulière des incondensables, Maintenance, Froid, Utilités"
32,"Réparation des fuites, tuyauteries, et changement des joints, Maintenance, Froid, Utilités"
33,"Ouverture des portes des zones froides minimisée, Chambre froide, Froid, Utilités"
34,"Augmentation de la température d'évaporation, Régulation, Froid, Utilités"
35,"Diminution de la température de condensation, Régulation, Froid, Utilités"
36,"Diminution du taux d'air neuf en période de climatisation, Climatisation, CVC, Bâtiment"
39,"Pilotage des compresseurs en cascade et compresseurs de puissances différentes, Régulation, Froid, Utilités"
40,"Variation électronique de vitesse sur ventilateurs de soufflage des évaporateurs, Evaporateur, Froid, Utilités"
41,"Mise en route graduelle des ventilateurs sur les aérocondenseurs, Condenseur, Froid, Utilités"
42,"Sous refroidissement optimisé, Régulation, Froid, Utilités"
43,"Gestion Technique Centralisée (GTC), Gestion et pilotage, Procédés"
44,"Système de régulation des cordons chauffant d'une porte d'armoire verticale à froid négatif, Meuble frigorifique, Froid, Utilités"
45,"Désurchauffeur pour récupérer la chaleur de condensation sur un cycle frigorifique., Récupération de chaleur, Froid, Utilités"
46,"Récupérateur de chaleur de condensation sur un groupe de production de froid, Récupération de chaleur, Froid, Utilités"
47,"Récupérateur de chaleur sur l'huile des compresseurs, Récupération de chaleur, Froid, Utilités"
48,"Machine frigorifique à absorption, Machines frigorifiques, Utilités"
49,"Remplacement des détendeurs par une turbine, Détendeur, Froid, Utilités"
50,"Moteurs correctement dimensionnés, Moteur, Moteur, Utilités"
51,"Dimensionnement des moteurs pour des charges variables, Ajustement production/besoin, Moteur, Utilités"
54,"Moteur à haut rendement, Moteur, Moteur, Utilités"
55,"Transmissions à haute efficacité, Transmission, Moteur, Utilités"
56,"Contrôle de la qualité de puissance, Régulation, Moteur, Utilités"
57,"Contrôle de la température ambiante, Moteur, Moteur, Utilités"
58,"Remplacement des moteurs plutôt qu'un rebobinage ou une réparation, Maintenance, Moteur, Utilités"
59,"Lubrification correcte des paliers conformément aux spécifications constructeur, Maintenance, Moteur, Utilités"
60,"Entretien et amélioration des transmissions, Transmission, Moteur, Utilités"
61,"Rebobinage de qualité des moteurs, Maintenance, Moteur, Utilités"
62,"Ajustement de la tension des courroies et des alignements, Transmission, Moteur, Utilités"
63,"Variateurs de vitesse en remplacement de vannes de laminages., Régulation, Pompe, Utilités"
64,"Pompe de surpression pour des hautes pressions ponctuelles, Pompe de surpression, Pompe, Utilités"
65,"Pompes en parallèle, mise en route en fonction du besoin, Régulation, Pompe, Utilités"
66,"Matériel de mesure pour contrôler la perte de charge, et les débits des pompes., Mesure et comptage d’énergie, Management (ISO 50 001)"
67,"Réduction du besoin de pompage non nécessaire, Ajustement production/besoin, Pompe, Utilités"
68,"Fermeture des parties du circuit non utilisées, Réseau, Pompe, Utilités"
69,"Purges d'air régulières sur le réseau, Réseau, Pompe, Utilités"
70,"Identification et remplacement des pompes surdimensionnées, Pompe, Pompe, Utilités"
71,"Réparation des fuites, Réseau, Pompe, Utilités"
72,"Vérification de l'usure des pompes, et identification des pompes en cavitation., Maintenance, Pompe, Utilités"
73,"Usinage du diamètre des roues des pompes centrifuges, Pompe, Pompe, Utilités"
74,"Filtre interne de réduction de frottements dans la pompe (sur les impulseurs), Pompe, Pompe, Utilités"
75,"Diminution des débits et de la pression de fonctionnement aux minimum requis, Ajustement production/besoin, Pompe, Utilités"
76,"Diminution des pertes de charges, Réseau, Pompe, Utilités"
77,"Diminution des débits by-pass, Réseau, Pompe, Utilités"
78,"Consommation de biogaz, Valorisation, Méthanisation / Biogaz, Nouvelles énergies"
79,"Variateur de vitesse sur ventilateur centrifuge pour gestion du débit d'air optimisé, Régulation, Ventilation, Utilités"
80,"Ventilateur avec un régime optimal correspond aux besoins spécifiques de l'installation, Gestion et pilotage, Ventilation, Utilités"
81,"Fonctionnement du ventilateur d'extraction au fonctionnement du process industriel, Gestion et pilotage, Ventilation, Utilités"
82,"Diminution des pertes de charges du réseau, Réseau, Ventilation, Utilités"
83,"Ventilateur avec roue à réaction en remplacement d'un ventilateur avec roue à action, Ventilateur, Ventilation, Utilités"
84,"Remplacement des courroies trapézoïdales par des transmissions directes, Ventilateur, Ventilation, Utilités"
85,"Remplacement des courroies trapézoïdales par des courroies plates, Ventilateur, Ventilation, Utilités"
86,"Fractionnement de l'installation de ventilation générale en plusieurs unités, Gestion et pilotage, Ventilation, Utilités"
87,"Isolation des gaines lorsque l'air est chaud, Réseau, Ventilation, Utilités"
88,"Mesure des valeurs clés de l'installation pour repérer rapidement les anomalies, Gestion et pilotage, Ventilation, Utilités"
89,"Nettoyage et dépoussiérage des conduites et remplacement régulierer des filtres, Maintenance, Ventilation, Utilités"
90,"Diminution des fuites sur le réseau aéraulique en resserrant les joints, Maintenance, Ventilation, Utilités"
91,"Equilibrage du réseau aéraulique, Réseau, Ventilation, Utilités"
92,"Remplacement des ventilateurs surdimensionnés par des moteurs haute efficacité (IE3 par exemple), Ventilateur, Ventilation, Utilités"
93,"Vérification et diminution des débits d'air si possible, Ajustement production/besoin, Ventilation, Utilités"
94,"Epurateur pour réduire le taux d'air neuf en hiver, Ajustement production/besoin, Ventilation, Utilités"
95,"Récupérateur de chaleur air neuf/air extrait, Récupération de chaleur, Ventilation, Utilités"
97,"Amélioration de l'isolation des bâtiments, Isolation, Enveloppe, Bâtiment"
99,"Réduction des infiltrations d'air, Etanchéité et infiltrations, Enveloppe, Bâtiment"
100,"Optimisation de la fermeture automatique des portes logistiques, Etanchéité et infiltrations, Enveloppe, Bâtiment"
102,"Réduction des apports de chaleur dans les espaces climatisés, Climatisation, CVC, Bâtiment"
103,"Ne pas chauffer et climatiser en même temps, Climatisation, CVC, Bâtiment"
104,"Pompe à chaleur haute température pour valoriser la vapeur basse pression, Récupération de chaleur, Vapeur, Utilités"
105,"Système de chauffage radiant (zones occupées) couplé à une réduction des températures (zones non occupées), Chauffage, CVC, Bâtiment"
108,"Diminution des températures de consignes de chauffage, Chauffage, CVC, Bâtiment"
109,"Maintenance régulière des systèmes de climatisation, Climatisation, CVC, Bâtiment"
110,"Free-cooling pour les espaces réfrigérés, Climatisation, CVC, Bâtiment"
111,"Free-chilling par un court d'eau à proximité., Condenseur, Froid, Utilités"
113,"Compensation de l'énergie réactive, Condensateur, Distribution électrique, Utilités"
114,"Filtres anti-harmoniques proche des sources très polluantes, Filtre, Distribution électrique, Utilités"
115,"Circuits séparés pour les systèmes générateurs d'harmoniques et pour les circuits sensibles aux harmoniques, Réseau, Distribution électrique, Utilités"
116,"Diamètre double pour les fils neutres près des charges génératrices d'harmoniques, Réseau, Distribution électrique, Utilités"
117,"Séparation des circuits alimentant les gros moteurs pour éviter que les autres appareils subissent les chutes de tensions crées lors de leur démarrage, Réseau, Distribution électrique, Utilités"
118,"Dimensionnement des câbles correct et vérifié, Gestion et pilotage, Distribution électrique, Utilités"
120,"Transformateur haut rendement, Transformateur, Distribution électrique, Utilités"
121,"Dimensionnement des transformateurs en adéquation avec l'utilisation, Transformateur, Distribution électrique, Utilités"
122,"Remplacement de TGBT vétuste, Transformateur, Distribution électrique, Utilités"
123,"Eléments du TGBT faiblement consommateur pour éviter une climatisation du local, Armoire électrique, Distribution électrique, Utilités"
124,"Renouvellement d'air du local du transformateur pour son refroidissement, Transformateur, Distribution électrique, Utilités"
125,"Transformateurs à refroidissement par convection naturelle, Transformateur, Distribution électrique, Utilités"
126,"Placement des équipements pour lesquels la demande en courant est élevée, aussi près que possible de la source d'alimentation, Ajustement production/besoin, Distribution électrique, Utilités"
127,"Nettoyage des traversées et les connexions pour limiter les risques de corrosion ou de rouille, Maintenance, Distribution électrique, Utilités"
128,"Détection des points chauds des câbles et des armoires, Armoire électrique, Distribution électrique, Utilités"
129,"Nouveaux onduleur en remplacement des anciens onduleurs, Onduleur, Distribution électrique, Utilités"
130,"Vérification l'équilibrage des phases, Gestion et pilotage, Distribution électrique, Utilités"
131,"Vérification du branchement des systèmes monophasés et triphasés. Le monophasé ne doit pas être branché sur du triphasé, Maintenance, Distribution électrique, Utilités"
132,"Maintenance annuelle des équipement électrique et du transformateur, Maintenance, Distribution électrique, Utilités"
133,"Jeux de barres serrés., Armoire électrique, Distribution électrique, Utilités"
134,"Détection des surcharges, Ajustement production/besoin, Distribution électrique, Utilités"
135,"Maintenance du transformateur, Transformateur, Distribution électrique, Utilités"
136,"Arrêt des équipements quand ils ne sont pas nécessaires, Régulation, Distribution électrique, Utilités"
137,"Mainten en ligne les transformateurs fonctionnant à une charge de plus de 40 à 50 % de la puissance nominale, Transformateur, Distribution électrique, Utilités"
138,"Diminution de la tension de court circuit du transformateur, Transformateur, Distribution électrique, Utilités"
139,"Amélioration du facteur de puissance, Gestion et pilotage, Distribution électrique, Utilités"
140,"Décalage des appels de puissance, Ajustement production/besoin, Distribution électrique, Utilités"
141,"Effacement des creux de tension, Onduleur, Distribution électrique, Utilités"
142,"Stockage permettant de décaler la consommation, Stockage, Distribution électrique, Utilités"
143,"Surpresseur et réseau d'air multi pressions pour répondre aux besoins localisés, Réseau, Air comprimé, Utilités"
144,"Vannes d’isolement pour couper l’arrivée d’air comprimé des ateliers non utilisés, Réseau, Air comprimé, Utilités"
145,"Production d'air décentralisée, Gestion et pilotage, Air comprimé, Utilités"
146,"Démarrage des compresseurs en fonction du besoin, Régulation, Air comprimé, Utilités"
147,"Amélioration du refroidissement, du séchage et de la filtration, Traitement de l'air, Air comprimé, Utilités"
148,"Optimisation de la régulation, Régulation, Air comprimé, Utilités"
149,"Système de régulation élaboré, Régulation, Air comprimé, Utilités"
150,"Stockage de l'air comprimé à proximité des utilisations à forte fluctuation, Stockage, Air comprimé, Utilités"
151,"Augmentation de la taille des cuves de stockage, Stockage, Air comprimé, Utilités"
152,"Arrêt des compresseurs quand il n'y a pas de demande d'air, Gestion et pilotage, Air comprimé, Utilités"
153,"Petit compresseur pour la nuit et les week end, Ajustement production/besoin, Air comprimé, Utilités"
154,"Modernisation du compresseur, Compresseur, Air comprimé, Utilités"
155,"Purgeurs automatiques en remplacement de purgeurs manuels, Régulation, Air comprimé, Utilités"
156,"Remplacement des outils pneumatiques par des outils électriques lorsque c'est possible, Soufflette, Air comprimé, Utilités"
157,"Suppression des soufflettes, Soufflette, Air comprimé, Utilités"
158,"Optimisation de la pression des soufflettes, Soufflette, Air comprimé, Utilités"
159,"Soufflantes en remplacement de couteaux d'air, Soufflette, Air comprimé, Utilités"
160,"Campagne de détection des fuites sur un réseau d’air comprimé, Réseau, Air comprimé, Utilités"
161,"Maintenance préventive, Maintenance, Air comprimé, Utilités"
162,"Nettoyage et remplacement plus fréquents des filtres, Filtre, Air comprimé, Utilités"
163,"Réduction des pertes de charge, Réseau, Air comprimé, Utilités"
164,"Vérification des purges de condensats, Purgeurs et condensats, Air comprimé, Utilités"
165,"Purgeurs de condensats sans pertes d'air, Purgeurs et condensats, Air comprimé, Utilités"
167,"Participation du personnel dans la recherche de fuite, Maintenance, Air comprimé, Utilités"
168,"Filtres à faible perte de charge, Filtre, Air comprimé, Utilités"
169,"Placement des filtres en parallèle lors de l'augmentation de la capacité de filtrage, Filtre, Air comprimé, Utilités"
170,"Diminution de la pression le week end, Régulation, Air comprimé, Utilités"
171,"Aspiration des compresseurs là où l'air est le plus frais, Compresseur, Air comprimé, Utilités"
172,"Filtration et séchage au minimum requis, Traitement de l'air, Air comprimé, Utilités"
174,"Ajustement du degré de séchage en fonction de la température extérieure, Traitement de l'air, Air comprimé, Utilités"
176,"Récupération de la chaleur des compresseurs pour production d'eau chaude, Récupération de chaleur, Air comprimé, Utilités"
178,"Récupération d'énergie sur compresseur pour regénérer le sécheur à absorption, Récupération de chaleur, Air comprimé, Utilités"
179,"Optimisation du dimensionnement des tuyauteries, Réseau, Vapeur, Utilités"
180,"Diminution des longueurs de tuyauterie, Réseau, Vapeur, Utilités"
181,"Utilisation de turbines à contre pression à la place des soupapes de réduction de pression, Vanne, Vapeur, Utilités"
182,"Isolation des canalisations vapeur non isolées, Réseau, Vapeur, Utilités"
183,"Isolation des canalisations vapeur non utilisées, Réseau, Vapeur, Utilités"
184,"Utilisation de vapeur au minimum nécessaire, Gestion et pilotage, Vapeur, Utilités"
185,"Compteurs pour les débits de vapeur et les débits de condensats, Gestion et pilotage, Vapeur, Utilités"
186,"Dépressurisation du condensat, Condensat, Vapeur, Utilités"
187,"Arrêt des chaudières vapeur lorsqu'elles ne sont pas nécessaires, Régulation, Chaudière, Utilités"
188,"Installation d'un registre d'isolement des gaz de combustion ( coupe-tirage ) des chaudières vapeur, Fumées, Chaudière, Utilités"
189,"Minimisation des pertes dues aux cycles courts des chaudières vapeur, Régulation, Chaudière, Utilités"
191,"Programme d'inspection et de réparation des purgeurs, Purgeur, Vapeur, Utilités"
192,"Remplacement des purgeurs défaillants bloqués en position ouverte ou fermé, Purgeur, Vapeur, Utilités"
193,"Vérification de la dimension des purgeurs et remplacement si nécessaire, Purgeur, Vapeur, Utilités"
194,"Vérification de l'état et le dimensionnement de l'isolation et remplacer celle-ci quand nécessaire, Réseau, Vapeur, Utilités"
196,"Elimination des fuites de vapeur, Réseau, Vapeur, Utilités"
197,"Réduction des fuites de condensats, Condensat, Vapeur, Utilités"
198,"Analyse de l'état du réseau vapeur et du réseau des condensats, Réseau, Vapeur, Utilités"
199,"Analyse thermographique du réseau et de la chaudière, Condensat, Vapeur, Utilités"
200,"Prévention et élimination des dépôts de tartre sur les surfaces de transfert de chaleur, Echangeur thermique, Vapeur, Utilités"
201,"Ajout ou réparation des réfractaires d'une chaudière vapeur, Maintenance, Chaudière, Utilités"
202,"Vapeur sèche pour le procédé, Gestion et pilotage, Vapeur, Utilités"
203,"Diminution du débit vapeur quand cela est possible, Gestion et pilotage, Vapeur, Utilités"
204,"Réduction de la pression quand cela est possible, Régulation, Vapeur, Utilités"
205,"Amélioration des procédures et des contrôles des chaudières vapeur, Maintenance, Chaudière, Utilités"
206,"Chaudière à eau chaude en remplacement d'une chaudière vapeur, Chaudière, Chaudière, Utilités"
207,"Contrôle séquentiel des chaudières vapeur, Régulation, Chaudière, Utilités"
208,"Minimisation des purges de la chaudière en améliorant le traitement de l'eau, Traitement de l'eau, Chaudière, Utilités"
209,"Optimisation du taux de mise à l'air libre du desaérateur, Désaérateur, Vapeur, Utilités"
210,"Augmentation du rendement de l'économiseur, Récupération de chaleur, Ventilation, Utilités"
211,"Récupération du condensat, Condensat, Vapeur, Utilités"
212,"Récupération de la chaleur du condensat, Récupération de chaleur, Vapeur, Utilités"
213,"Préchauffage de l'eau d'alimentation par utilisation de la chaleur procédé, Récupération de chaleur, Vapeur, Utilités"
214,"Economiseur sur les effluents gazeux de chaudière de production de vapeur, Récupération de chaleur, Chaudière, Utilités"
215,"Préchauffage de l'eau : utiliser l'eau d'alimentation désaérée pour chauffer le condensat retournant à la chaudière, Récupération de chaleur, Vapeur, Utilités"
216,"Préchauffage de l'eau d'alimentation en condensant la vapeur utilisée pour la revaporisation et en chauffant l'eau alimentant le desaérateur au moyen d'un échangeur, Récupération de chaleur, Vapeur, Utilités"
217,"Réemploi de la vapeur de détente, Récupération de chaleur, Vapeur, Utilités"
218,"Récupération de l'énergie provenant des purges de vapeur, Récupération de chaleur, Vapeur, Utilités"
219,"Turbine de détente pour récupérer le contenu énergétique de gaz sous pression, Réseau, Vapeur, Utilités"
221,"Adaptation de l'éclairage artificiel au besoin réel de chaque zone, Gestion et pilotage, Eclairage, Bâtiment"
222,"Gradation de l'éclairage en fonction de la luminosité ambiante par des ballasts électroniques de catégorie A1, Régulation, Eclairage, Bâtiment"
223,"Remplacement des lampes incandescentes par des fluo-compactes (basse consommations), Luminaire, Eclairage, Bâtiment"
225,"Adaptateur T5 sur luminaire T8 existant, Luminaire, Eclairage, Bâtiment"
226,"Tubes à LED pour l'éclairage intérieur en remplacement de tubes T8, Luminaire, Eclairage, Bâtiment"
227,"Tube fluorescent T5 à douilles G13 pouvant être installés directement sur des luminaires T8, Luminaire, Eclairage, Bâtiment"
228,"Gradation de l'éclairage en fonction de la luminosité ambiante par des régulateurs sur lampes à décharge, Régulation, Eclairage, Bâtiment"
229,"Interrupteur crépusculaire, Gestion et pilotage, Eclairage, Bâtiment"
230,"Horloge astronomique, Régulation, Eclairage, Bâtiment"
231,"Système de télésurveillance et de télégestion, Régulation, Eclairage, Bâtiment"
232,"Nettoyage périodique des luminaires, Maintenance, Eclairage, Bâtiment"
233,"Suppression des lampes inutiles dès que possible, Maintenance, Eclairage, Bâtiment"
234,"Débranchement des ballast électroniques inutilisés, Maintenance, Eclairage, Bâtiment"
235,"Réduction de l'éclairage général et renforcement de l'éclairage local des postes de travail, Régulation, Eclairage, Bâtiment"
236,"Eclairage naturel : puits de jour, lanterneaux d'éclairage zénithal, Eclairage naturel, Eclairage, Bâtiment"
239,"Consignes au personnel pour l'extinction des lumières des pièces non occupées ou des couloirs, Gestion et pilotage, Eclairage, Bâtiment"
240,"Cogénération : autoproduction de son électricité ou revente au réseau, Cogénération grande taille, Cogénération"
241,"Révision du contrat électrique et adaptation de la puissance souscrite, Contrat, Gestion des énergies, Management (ISO 50 001)"
242,"Optimisation du contrat d'électricité règlementé, Contrat, Gestion des énergies, Management (ISO 50 001)"
243,"Démarreur sur les moteurs électriques, Régulation, Moteur, Utilités"
245,"Mesure, comptage et sous comptage d'énergie des unités consommatrices, Indicateurs et tableau de bord, Mesure et comptage d’énergie, Management (ISO 50 001)"
246,"Récupération de la chaleur perdue des gaz de combustion, Récupération de chaleur, Chaudière, Utilités"
248,"Système de contrôle des durées d'allumage des brûleurs, Brûleur, Chaudière, Utilités"
249,"Moteur à haut rendement label IE2 (EFF1), Moteur, Moteur, Utilités"
250,"Isolation des combles ou de toiture, Isolation, Enveloppe, Bâtiment"
251,"Isolation des murs par l'intérieur, Isolation, Enveloppe, Bâtiment"
252,"Isolation d'un plancher, Isolation, Enveloppe, Bâtiment"
253,"Fenêtres à double vitrage avec isolation renforcée à l'argon, Isolation, Enveloppe, Bâtiment"
254,"Isolation des murs par l'extérieur, Isolation, Enveloppe, Bâtiment"
255,"Isolation des toitures terrasses et couvertures de faible pente, Isolation, Enveloppe, Bâtiment"
256,"Sensibilisation du personnel sur le coût élevé du chauffage, Chauffage, CVC, Bâtiment"
257,"Sensibilisation du personnel sur le coût élevé de la production de vapeur, Gestion et pilotage, Vapeur, Utilités"
258,"Sensibilisation du personnel sur le coût élevé de la production de l'air comprimé, Gestion et pilotage, Air comprimé, Utilités"
259,"Sensibilisation du personnel sur le coût élevé de la production de froid, Gestion et pilotage, Froid, Utilités"
260,"Sensibilisation du personnel sur le coût élevé du chauffage et de la climatisation, Climatisation, CVC, Bâtiment"
261,"Programme de maintenance pour les portes et les fenêtres, Vitrage, Enveloppe, Bâtiment"
262,"Vérification de la présence de traces d'humidité, Etanchéité et infiltrations, Enveloppe, Bâtiment"
263,"Identification des conduits ou cheminées inutiles, Etanchéité et infiltrations, Enveloppe, Bâtiment"
264,"Arrêt des ventilateurs de rafraîchissement en hiver, Ventilation, CVC, Bâtiment"
265,"Asservissement du chauffage à l'ouverture des portes et fenêtres, Chauffage, CVC, Bâtiment"
266,"Séparation des parties chauffées et non chauffées du bâtiment, Chauffage, CVC, Bâtiment"
267,"Réduction de l'air entrant au niveau des quais d'expéditions, Etanchéité et infiltrations, Enveloppe, Bâtiment"
268,"Chauffage efficace des locaux de grande hauteur, Chauffage, CVC, Bâtiment"
269,"Isolation des parois verticales entre les ateliers, Isolation, Enveloppe, Bâtiment"
270,"Protections solaires pour l'été, Vitrage, Enveloppe, Bâtiment"
271,"Faux plafonds pour limiter le volume chauffé, Chauffage, CVC, Bâtiment"
272,"Vérification de la présence de fuites d'eau, Maintenance, Chaudière, Utilités"
273,"Contrôle régulier des chaudières vapeur, Maintenance, Chaudière, Utilités"
274,"Chaudière de type basse température, Chaudière, Chaudière, Utilités"
