Solution_ID,Text
701,"Tube fluorescent de type T5, Luminaire, Eclairage, Bâtiment"
705,"Optimisation du traitement d'eau, Traitement de l'eau, Chaudière, Utilités"
706,"Identification du phénomène de primage, Maintenance, Chaudière, Utilités"
707,"isolation de la bâche alimentaire, Bâche alimentaire, Vapeur, Utilités"
708,"Système de contrôle/commande de la combustion, Régulation, Fours, combustion, Procédés"
709,"Ratio consommation d'énergie par tonne de vapeur, Echangeur thermique, Vapeur, Utilités"
710,"Réinjection des condensats dans la bâche alimentaire avec une légère surpression, Bâche alimentaire, Vapeur, Utilités"
711,"Echangeur de récupération de chaleur, Récupération de chaleur, Chaudière, Utilités"
712,"Décentralisation de la production de vapeur, Gestion et pilotage, Chaudière, Utilités"
713,"Analyse de la répartition des consommations électriques, Indicateurs et tableau de bord, Mesure et comptage d’énergie, Management (ISO 50 001)"
714,"Arrêt des équipements non-utilisés, Bureautique, Bâtiment"
715,"Equipements munis du label Energy Star, Bureautique, Bâtiment"
716,"Recharge des batteries d'appareils de manutention la nuit, Appareils électriques, Bâtiment"
717,"Régulateur pour extinction automatiques des appareils, Régulation, Distribution électrique, Utilités"
718,"Contrainte d’efficacité énergétique intégrée lors des travaux réglementaires, Isolation, Enveloppe, Bâtiment"
719,"Système de Variation Electronique de Vitesse (VEV) sur un moteur électrique, Régulation, Moteur, Utilités"
720,"Récupérateur de chaleur sur un compresseur d'air comprimé (hors chauffage des locaux), Récupération de chaleur, Air comprimé, Utilités"
721,"Transformateur à haut rendement pour l'alimentation basse tension d'un site industriel, Transformateur, Distribution électrique, Utilités"
722,"Moto-variateur synchrone à aimants permanents, Moteur, Moteur, Utilités"
723,"Régulation pour une basse pression flottante, Régulation, Froid, Utilités"
724,"Haute pression flottante, Régulation, Froid, Utilités"
725,"Brûleur avec dispositif de récupération de chaleur sur four industriel, Brûleur, Fours, combustion, Procédés"
726,"Système de régulation de tension en éclairage extérieur, Régulation, Eclairage, Bâtiment"
727,"Système de maîtrise de la puissance réactive en éclairage extérieur, Gestion et pilotage, Eclairage, Bâtiment"
728,"Système de variation de puissance en éclairage extérieur, Régulation, Eclairage, Bâtiment"
729,"Luminaire d'éclairage extérieur performant, Luminaire, Eclairage, Bâtiment"
731,"Transformateur à haut rendement pour la distribution publique d'électricité, Transformateur, Distribution électrique, Utilités"
732,"Production de chaleur renouvelables ou de récupération en réseau, Production, Réseau de chaleur, Technologies énergétiques"
733,"Injection de mousse isolante dans un caniveau de réseau de chaleur., Réseau, Réseau de chaleur, Technologies énergétiques"
734,"Réhabilitation d'un poste de livraison de chaleur, Réseau, Réseau de chaleur, Technologies énergétiques"
736,"Ballon de stockage d'eau chaude de type ""Open Buffer"", Production, Eau de procédés, Eau"
737,"Ballon de stockage d'eau chaude pour les serres agricoles, Production, Eau de procédés, Eau"
738,"Pré-refroidisseur de lait, Récupération de chaleur, Froid, Utilités"
739,"Ordinateur climatique avec module d'intégration de température pour l'agriculture, Chauffage, CVC, Bâtiment"
742,"Contrôle du moteur d'un tracteur, Maintenance, Transport, Technologies énergétiques"
743,"Inventaire et évaluation des systèmes de pompage, Gestion et pilotage, Pompe, Utilités"
744,"Contrat EJP, Contrat, Gestion des énergies, Management (ISO 50 001)"
745,"Comparaison par rapport à une consommation de référence, et partage des gains aux salariés, Sensibilisation, Organisation, Management (ISO 50 001)"
746,"Couleurs claires pour les murs, Gestion et pilotage, Bâtiment"
748,"Arrêt des appareils électriques, Appareils électriques, Bâtiment"
749,"Dégivrage du réfrigérateur, Appareils électriques, Bâtiment"
750,"Fermeture des robinets et identification des fuites, Réseau, Eau Chaude Sanitaire, Eau"
752,"Entretien du chauffe eau, Production, Eau Chaude Sanitaire, Eau"
753,"Manipulation des ampoules par le culot pour préserver leur durée de vie, Maintenance, Eclairage, Bâtiment"
754,"Programmation des lessives aux heures économiques, Appareils électriques, Bâtiment"
755,"Rincage des plats les plus sales sous l'eau froide avant de les mettre au lave vaisselle, Appareils électriques, Bâtiment"
756,"Congélateur installé dans une zone sèche, Appareils électriques, Bâtiment"
757,"Diminution du temps d'ouverture des portes du réfrigérateur et congélateur, Appareils électriques, Bâtiment"
758,"Réglage des équipements frigorifiques à une température optimale, Appareils électriques, Bâtiment"
759,"Préférence des douches plutôt que des bains afin d'économiser l'eau., Réseau, Eau Chaude Sanitaire, Eau"
760,"Vérification des fuites au niveau des chasses d'eau, Réseau, Eau Chaude Sanitaire, Eau"
761,"Utilisation d'une chasse d'eau à double commande, Réseau, Eau Chaude Sanitaire, Eau"
763,"Entretien de la chaudière individuelle régulièrement, Maintenance, Chaudière, Utilités"
765,"Programmation du chauffage en fonction de la présence, Chauffage, CVC, Bâtiment"
766,"Nettoyage des convecteurs, Chauffage, CVC, Bâtiment"
767,"Fermeture des rideaux et volets la nuit, Chauffage, CVC, Bâtiment"
768,"Amélioration de l'isolation de fours à haute température, Maintenance, Fours, combustion, Procédés"
769,"Pré-séchage la matière humide par énergie solaire., Séchage, Procédés"
770,"Utilisation des lignes de production à leur capacité maximale., Gestion et pilotage, Procédés"
771,"Récupération de la chaleur de l'acier qui refroidit, Récupération de chaleur, Procédés"
772,"Logiciel embarqué de gestion des déplacements, Gestion et pilotage, Transport, Technologies énergétiques"
773,"Cartographie des fours, Gestion et pilotage, Fours, combustion, Procédés"
774,"Détendeurs électroniques pour optimiser la régulation frigorifique, Détendeur, Froid, Utilités"
776,"Isolation des process chauds, Gestion et pilotage, Procédés"
777,"Brûleurs haut rendement en remplacement de brûleurs vétustes, Brûleur, Fours, combustion, Procédés"
778,"Dimensionnement optimum des compresseurs et remplacement des équipements surdimensionnés., Compresseur, Air comprimé, Utilités"
779,"Diagnostic complet de la production et du réseau d'air comprimé, Gestion et pilotage, Air comprimé, Utilités"
780,"Récupération de la chaleur des procédés industriels, Récupération de chaleur, Procédés"
781,"Réduction catalytique du N2O dans des usines d'acide nitrique, Gaz industriel, Procédés"
782,"Destruction de N2O rejeté lors de la production de N2O applicable aux installations existantes, Gaz industriel, Procédés"
783,"Optimisation de la matière sèche, en amont du process de déshydratation – andainage, Séchage, Procédés"
784,"Chaufferie biomasse dans l'industrie en remplacement de chaudières à énergie fossile, Valorisation, Biomasse, Nouvelles énergies"
785,"Destruction de N2O émis par la production d’acide adipique, Gaz industriel, Procédés"
786,"Thermo-oxydation des Gaz à Effet de Serre effluents gazeux des installations de production industrielle, Gaz industriel, Procédés"
787,"Thermo-oxydation du prototype d’azote (N2O) dans les effluents gazeux des installations existantes de production industrielle, Gaz industriel, Procédés"
789,"Optimisation de la maintenance des moteurs, Maintenance, Moteur, Utilités"
790,"Optimisation de l'efficacité des tours de refroidissement, Condenseur, Froid, Utilités"
791,"Régulation de débit par variation électronique de vitesse asservie à la pression, Régulation, Pompe, Utilités"
793,"Diminution de la surchauffe, Régulation, Froid, Utilités"
794,"Maintenance des pompes et réseaux d'eau, Maintenance, Pompe, Utilités"
796,"Campagne d'analyse de l'énergie réactive par bâtiment, Gestion et pilotage, Distribution électrique, Utilités"
797,"Suivi de la facturation d’électricité, Contrat, Gestion des énergies, Management (ISO 50 001)"
798,"Récupération de l'excès de vapeur, Récupération de chaleur, Vapeur, Utilités"
799,"Réparation du four pour éliminer les entrées d'air sauvages, Maintenance, Fours, combustion, Procédés"
800,"Récupération de chaleur pour alimenter un réseau de chaleur urbain, Récupération de chaleur, Procédés"
801,"Création d'une unité de recyclage et de valorisation des appareils frigorifiques ménagers, Tri, Déchets"
802,"Développement d'une fonte à faible résistivité, Gestion et pilotage, Procédés"
803,"Analyse du besoin en froid des procédés pour identifier la répartition des besoins, Gestion et pilotage, Froid, Utilités"
804,"Valorisation des rejets pour créer du biogaz par méthanisation, Valorisation, Méthanisation / Biogaz, Nouvelles énergies"
805,"Regroupement de plusieurs sites pour réduire les flux de camions, Gestion et pilotage, Transport, Technologies énergétiques"
806,"Bande transporteuse entre l'arrivée des matières et la zone de rangement., Matériel roulant, Transport, Technologies énergétiques"
807,"Dispositif de visioconférence sur les sites du groupe, Gestion et pilotage, Transport, Technologies énergétiques"
808,"Fermeture isolante, Vitrage, Enveloppe, Bâtiment"
810,"Chauffe-eau thermodynamique individuel à accumulation, Production, Eau Chaude Sanitaire, Eau"
812,"Pompe à chaleur collective à absorption de type air/eau ou eau/eau, Chauffage, CVC, Bâtiment"
813,"Chaudière de type basse température couplée à une ventilation mécanique contrôlée pilotée par la chaudière, Chaudière, Chaudière, Utilités"
814,"Chauffe-eau électrique à accumulation de catégorie C, Production, Eau Chaude Sanitaire, Eau"
817,"Porte pour fermeture des meubles frigorifiques de vente à température positive, Meuble frigorifique, Froid, Utilités"
818,"Réduction des apports solaires par la toiture, Isolation, Enveloppe, Bâtiment"
820,"Pompe à chaleur à absorption de type air/eau ou eau/eau, Chauffage, CVC, Bâtiment"
821,"Pompe à chaleur à moteur gaz de type air/eau, Chauffage, CVC, Bâtiment"
823,"Ventilo-convecteur haute performance, Chauffage, CVC, Bâtiment"
824,"Dé-stratificateur d'air, Chauffage, CVC, Bâtiment"
826,"Evaporateur performant, Evaporateur, Froid, Utilités"
827,"Gonflage des pneumatiques pour véhicules légers et véhicules utilitaires légers, Maintenance, Transport, Technologies énergétiques"
828,"Décreusage des pneumatiques de poids lourds, Maintenance, Transport, Technologies énergétiques"
829,"Changement de catégorie de consommation des véhicules de flottes professionnelles, Matériel roulant, Transport, Technologies énergétiques"
831,"Récupérateur de chaleur sur un tank à lait, Récupération de chaleur, Froid, Utilités"
832,"Chaufferie biomasse dans l'agriculture, Chaudière, Chaudière, Utilités"
833,"Pompe à chaleur de type eau/eau ou air/eau dans l'agriculture, Chauffage, CVC, Bâtiment"
834,"Basse pression flottante dans l'agriculture, Régulation, Froid, Utilités"
835,"Haute pression flottante dans l'agriculture, Régulation, Froid, Utilités"
836,"Double écran thermique pour les serres agricoles, Isolation, Enveloppe, Bâtiment"
839,"Tube fluorescent haut rendement T8 sur un dispositif d'éclairage, Luminaire, Eclairage, Bâtiment"
840,"Formation de chefs d'entreprises, salariés et artisans du bâtiments aux économies d'énergie, Covoiturage, Transport, Technologies énergétiques"
844,"Ventilation mécanique répartie, Ventilation, CVC, Bâtiment"
845,"Panneaux rayonnants électriques ou radiateurs à régulation électronique, Chauffage, CVC, Bâtiment"
846,"Lampe fluo-compacte avec globe de classe B, Luminaire, Eclairage, Bâtiment"
847,"Remplacement de lampes à vapeur de mercure par des technologies performantes, Luminaire, Eclairage, Bâtiment"
849,"GTC qui contrôle l'éclairage intérieur et extérieur, Gestion et pilotage, Eclairage, Bâtiment"
850,"Remplacement des luminaires T8 par des luminaires T5 avec ballast électronique intégré, Gestion et pilotage, Eclairage, Bâtiment"
851,"Remplacement des lampes à vapeur de mercure à ballast magnétique par des tubes fluorescents T5, Luminaire, Eclairage, Bâtiment"
852,"Remplacement des anciens équipements par des lampes plus efficaces et de puissances inférieures, Gestion et pilotage, Eclairage, Bâtiment"
853,"Remplacement des câbles électriques mal dimensionnés, Réseau, Distribution électrique, Utilités"
854,"Réglage de la luminosité avec une télécommande, Gestion et pilotage, Eclairage, Bâtiment"
855,"Ballasts électroniques de catégorie A2 en remplacement de ballasts ferromagnétiques, Régulation, Eclairage, Bâtiment"
856,"Ajout d'interrupteurs pour contrôler l'allumage par zones dans une pièce, Gestion et pilotage, Eclairage, Bâtiment"
857,"Gestion Technique Centralisée (GTC) sur les centrales de traitement d'air, Ventilation, CVC, Bâtiment"
858,"Panneaux photovoltaïques pour alimenter les systèmes d'éclairage, Capteur, Solaire photovoltaïque, Nouvelles énergies"
859,"Lampes à sodium haute pression pour éclairage extérieur en remplacement de lampe à vapeur de mercure, Luminaire, Eclairage, Bâtiment"
861,"Lampes à décharge avec réduction de la tension d'allumage intégrée, Luminaire, Eclairage, Bâtiment"
863,"LED pour la signalisation tricolore, Luminaire, Eclairage, Bâtiment"
864,"Vanne d'isolation sur l'arrivée vapeur, Vanne, Vapeur, Utilités"
865,"Dégazeurs thermiques sur chaudière vapeur, Traitement de l'eau, Chaudière, Utilités"
866,"Révision du système frigorifique, Gestion et pilotage, Froid, Utilités"
867,"Gestion centralisée de la production frigorifique, Gestion et pilotage, Froid, Utilités"
868,"Compteurs pour suivre la consommation d'eau chaude, Réseau, Eau Chaude Sanitaire, Eau"
869,"Stockage pour récupération de l'eau perdue, Réseau, Eau de procédés, Eau"
870,"Réutilisation du CO2 émis par les process pour injection dans procédé de fermentation, Gaz industriel, Procédés"
871,"Compresseurs frigorifiques de type Scroll, Centrale froid, Froid, Utilités"
872,"Délestage des équipements électriques, Ajustement production/besoin, Moteur, Utilités"
873,"Brûleurs de gaz naturel à veine d'air en remplacement des échangeurs de vapeur, Séchage, Procédés"
874,"Création d'une installation de prétraitement des effluents, Production, Assainissement, Eau"
875,"Brûleur bas-NOX, Brûleur, Fours, combustion, Procédés"
876,"Arrêt des pompes quand les process ne tournent plus, Ajustement production/besoin, Pompe, Utilités"
877,"Replacement du brûleur et des tubes de l'échangeur du four, Maintenance, Fours, combustion, Procédés"
878,"Combustible de meilleure qualité, Gestion et pilotage, Chaudière, Utilités"
879,"Procédures d'arrêt des fours électriques optimisées, Gestion et pilotage, Fours, combustion, Procédés"
881,"Repositionement du bruleur pour être assuré qu'il couvre la totalité de la chambre de combustion., Brûleur, Fours, combustion, Procédés"
882,"Amélioration de la conduite du procédé de fours pour acierie et aluminium, Régulation, Fours, combustion, Procédés"
883,"Récupération de chaleur sur un four à arc électrique, Récupération de chaleur, Procédés"
884,"Hottes au dessus des fours pour récupérer la chaleur, Récupération de chaleur, Fours, combustion, Procédés"
885,"Optimisation de la consommation de nitrogène dans la production d'acier, Gaz industriel, Procédés"
886,"Optimisation de la consommation d'oxygène dans la production d'acier, Gaz industriel, Procédés"
887,"Compteur d'eau pour suivre et comprendre les consommations, Réseau, Eau de procédés, Eau"
888,"Technologie de nettoyage performante adaptée au procédé, Maintenance, Procédés"
889,"Vérification le dimensionnement et l'utilisation des procédés en comparaison du besoin réel, Gestion et pilotage, Procédés"
890,"Augmentation de la température de consigne de la boucle d'eau de refroidissement, Ajustement production/besoin, Froid, Utilités"
891,"Variation de l'angle des pales du système tournant, Réseau, Ventilation, Utilités"
892,"Optimisation de la gestion des circuits électriques, Réseau, Distribution électrique, Utilités"
893,"Création d'un poste de gestionnaire de flux, Sensibilisation, Organisation, Management (ISO 50 001)"
894,"Identification puis remplacement des thermostats défectueux, Régulation, Chaudière, Utilités"
896,"Identification des sources de déperditions thermiques du bâtiment, Gestion et pilotage, Bâtiment"
897,"Analyse thermographique aérienne, Isolation, Enveloppe, Bâtiment"
898,"Unité de gazéification du bois, Gazéification, Nouvelles énergies"
899,"Production de Biodiesel, Biocarburant, Biocarburants, Nouvelles énergies"
900,"Véhicule fonctionnant au biogaz, Matériel roulant, Transport, Technologies énergétiques"
901,"Démarche HQE, Management (ISO 50 001)"
902,"Vanne thermo régulée sur un réseau d'eau glacée, Réseau, Froid, Utilités"
903,"Vérification et diminution si possible les températures de chauffe des process, Gestion et pilotage, Fours, combustion, Procédés"
904,"Remplacement du système de régulation sur le réseau d'eau chaude sanitaire, Production, Eau Chaude Sanitaire, Eau"
905,"Limiteur de débit sur les douches, Réseau, Eau Chaude Sanitaire, Eau"
906,"Réglage manuel des climatisations, Climatisation, CVC, Bâtiment"
907,"Dans les hôtels, remplissage prioritaire des chambres au nord en été et des chambres au sud en hiver, Gestion et pilotage, Bâtiment"
909,"Chaufferie collective à gaz pour réseau d'eau chaude sanitaire, Production, Eau Chaude Sanitaire, Eau"
910,"Minuteurs sur luminaires intérieurs, Régulation, Eclairage, Bâtiment"
912,"Minuteurs sur luminaires extérieurs, Régulation, Eclairage, Bâtiment"
913,"Installation d'une éolienne, Production, Eolien, Nouvelles énergies"
914,"Panneau solaire photovoltaïque, Capteur, Solaire photovoltaïque, Nouvelles énergies"
915,"Puits canadien pour préchauffer l'air, Chauffage, CVC, Bâtiment"
916,"Production d'hydrogène pour stocker l'électricité, Hydrogène / Pile à combustible, Nouvelles énergies"
917,"Isolation des fourreaux, Chauffage, Presse, Procédés"
918,"Optimisation de la température du circuit de refroidissement des presses, Refroidissement, Presse, Procédés"
919,"Presses à injecter tout-électrique en remplacement de presses à injecter hydrauliques, Circuit de puissance, Presse, Procédés"
920,"Récupération de chaleur sur l'épurateur des fours pour préchauffer la matière entrante, Récupération de chaleur, Fours, combustion, Procédés"
921,"Certification HQE, Management (ISO 50 001)"
922,"Récupération de chaleur des compresseurs pour réchauffer le sol sous la chambre froide., Récupération de chaleur, Froid, Utilités"
923,"Saumure pour le dégivrage des évaporateurs chauffée par récupération de chaleur, Récupération de chaleur, Froid, Utilités"
924,"Variation de la courbe de chauffe en fonction de la température extérieure, Régulation, Chaudière, Utilités"
925,"Electrovanne pour l'optimisation de la régulation, Régulation, Pompe, Utilités"
926,"Electrovannes sur les soufflettes d'air comprimé, Soufflette, Air comprimé, Utilités"
928,"Rafraichisseur d'air à évaporation directe, Climatisation, CVC, Bâtiment"
929,"Bouclage du réseau d'air comprimé, Réseau, Air comprimé, Utilités"
930,"Optimisation de la quantité de produits à sécher, Séchage, Procédés"
931,"Utilisation d'un four à sole tournante équipé de brûleurs régénératifs, Four, Fours, combustion, Procédés"
932,"Sensibilisation du personnel aux coûts de l'énergie, Sensibilisation, Organisation, Management (ISO 50 001)"
933,"Production au gaz semi-instantanée, Production, Eau Chaude Sanitaire, Eau"
935,"Four à oxycombustion, Brûleur, Fours, combustion, Procédés"
936,"Remplacement du four existant par un four plus performant, Four, Fours, combustion, Procédés"
937,"Récupérateur de chaleur sur compresseur d'air comprimé pour le chauffage de locaux., Récupération de chaleur, Air comprimé, Utilités"
938,"Utilisation prioritaire des centrales de production les plus proches de l'utilisation du réseau, Ajustement production/besoin, Air comprimé, Utilités"
940,"Optimisation du mode veille des presses à injection, Gestion et pilotage, Presse, Procédés"
941,"Optimisation du dosage des presses, Gestion et pilotage, Presse, Procédés"
942,"Chauffage des moules par induction sur presse à injecter, Chauffage, Presse, Procédés"
943,"Partage des bonnes pratiques entre les sites d'un même groupe, Stratégie et politique, Organisation, Management (ISO 50 001)"
944,"Clause d'efficacité énergétique dans les contrats d'exploitation et de maintenance, Contrat, Gestion des énergies, Management (ISO 50 001)"
945,"Niveau de pression optimum pour les pompes à vide, Ajustement production/besoin, Pompe, Utilités"
946,"Diagnostic énergétique bâtiment, Gestion et pilotage, Bâtiment"
947,"Centralisation du refroidissement hydraulique des presses à injection, Refroidissement, Presse, Procédés"
948,"Optimisation du diamètre des vis et fourreaux de presse à injecter et d'unité d'extrusion, Circuit de puissance, Presse, Procédés"
949,"Vérification de la qualité de l'air intérieur, Gestion et pilotage, Bâtiment"
950,"Démarche éco-conception, Management (ISO 50 001)"
951,"Compteurs d'énergie thermique, Mesure et comptage d’énergie, Management (ISO 50 001)"
954,"Suppression des bras morts du réseau et parties qui ne sont plus utilisées, Réseau, Air comprimé, Utilités"
955,"Campagne de mesures, Mesure et comptage d’énergie, Management (ISO 50 001)"
956,"Couplage du suivi énergétique avec le suivi de production au moyen de ratios, Indicateurs et tableau de bord, Mesure et comptage d’énergie, Management (ISO 50 001)"
958,"Optimisation du temps de mise en chauffe des presses, Gestion et pilotage, Presse, Procédés"
959,"Etalement du démarrage des presses, Maintenance, Presse, Procédés"
960,"Option points 10 minutes de la puissance électrique appelée, Contrat, Gestion des énergies, Management (ISO 50 001)"
961,"Emplacement optimisé des systèmes de chauffage radiant, Chauffage, CVC, Bâtiment"
962,"Remplacement des anciens équipements par des équipements récents plus performants, Chaudière, Chaudière, Utilités"
963,"Isolation hydraulique des chaudières quand elles ne sont pas utilisées, Régulation, Chaudière, Utilités"
965,"Amélioration du séchage de la vapeur, Gestion et pilotage, Vapeur, Utilités"
966,"Station météo couplée à la GTC, Chauffage, CVC, Bâtiment"
967,"Nettoyage du système d'eau de process, Production, Eau de procédés, Eau"
968,"Récupération instantanée de chaleur sur eaux grises pour la production d'ECS, Production, Eau Chaude Sanitaire, Eau"
969,"Fermetures des meubles frigorifiques de vente à température négative, Meuble frigorifique, Froid, Utilités"
970,"Système de management de l'énergie (norme ISO 50 001), Management (ISO 50 001)"
971,"Compresseur basse pression à vis, Compresseur, Air comprimé, Utilités"
974,"Système de management hors certification, Management (ISO 50 001)"
975,"Mesure et optimisation des consommations de carburant pour une unité de transport fluvial, Report modal, Transport, Technologies énergétiques"
976,"Carénage sur une unité de transport fluvial, Report modal, Transport, Technologies énergétiques"
977,"Tracteur routier optimisé, Matériel roulant, Transport, Technologies énergétiques"
978,"Pompe à chaleur de type eau/eau ou air/eau pour le chauffage de serres horticoles, Chauffage, CVC, Bâtiment"
979,"Récupérateur de chaleur à condensation pour serres horticoles, Récupération de chaleur, Chaudière, Utilités"
980,"Diminution des éclairages décoratifs, Régulation, Eclairage, Bâtiment"
981,"Certification ISO 14 001, Management (ISO 50 001)"
983,"Disposition de l'éclairage parallèle aux allées, Gestion et pilotage, Eclairage, Bâtiment"
984,"Camion de norme Euro 4 ou Euro 5, Matériel roulant, Transport, Technologies énergétiques"
985,"Optimisation du chargement des camions, Gestion et pilotage, Transport, Technologies énergétiques"
986,"Unité de production d'énergie géothermique, Géothermie, Nouvelles énergies"
987,"Micro éolienne pour alimenter les éclairages extérieurs, Production, Eolien, Nouvelles énergies"
989,"Récupération de l'eau de pluie, Réseau, Eau de procédés, Eau"
990,"Collectes des cartons et palettes pour incinération, Tri, Déchets"
991,"Compostage des déchets, Valorisation, Déchets"
992,"Tri des déchets dangereux, Tri, Déchets"
993,"Collecte sélective porte à porte, Tri, Déchets"
994,"Bassins de rétention pour nettoyage des camions, Gestion et pilotage, Transport, Technologies énergétiques"
995,"Utilisation de papiers recyclables / recyclés, Valorisation, Déchets"
996,"Suppression des prospectus, Tri, Déchets"
997,"Diminution des déchets plastiques, Tri, Déchets"
998,"Valorisation des produits éco-emballés, Valorisation, Déchets"
1000,"Adaptation des horaires de l'éclairage à l'occupation des bâtiments, Régulation, Eclairage, Bâtiment"
1001,"Soufflettes d'air comprimé plus performantes, Soufflette, Air comprimé, Utilités"
1002,"Amélioration du système d'eau glacée, Gestion et pilotage, Froid, Utilités"
1003,"Remplacement des chaudières vieillissantes par des équipements performants, Chaudière, Chaudière, Utilités"
