Solution_ID,Text
1004,"Vanne permettant de moduler la pression de distribution de la vapeur, Vanne, Vapeur, Utilités"
1005,"Optimisation des températures de séchage, Séchage, Procédés"
1006,"Isolation des séchoirs, Séchage, Procédés"
1007,"Séchoirs performants, Séchage, Procédés"
1008,"Vanne permettant d'isoler le départ vapeur, Vanne, Vapeur, Utilités"
1009,"Optimisation de la bâche d'eau glacée, Stockage, Froid, Utilités"
1010,"Système de commande prédictive sur un four, Régulation, Fours, combustion, Procédés"
1011,"Traitement efficaces des effluents, Production, Assainissement, Eau"
1012,"Augmentation du taux de recyclage des rebuts plastiques des presses à injecter, Valorisation, Déchets"
1013,"Four pâtissier électrique de haute qualité énergétique, Four, Fours, combustion, Procédés"
1014,"Variation électronique de vitesse sur hotte d'aspiration des procédés, Régulation, Ventilation, Utilités"
1016,"Séchage et vente de bois, Récupération de chaleur, Chaudière, Utilités"
1017,"Récupération de chaleur pour préchauffer l'air comburant, Récupération de chaleur, Procédés"
1018,"Isolation et la recirculation du stockage de carburant, Gestion et pilotage, Fours, combustion, Procédés"
1019,"Chaudières à lit fluidisés, Four, Fours, combustion, Procédés"
1020,"Amélioration du système d'alimentation en combustible, Brûleur, Fours, combustion, Procédés"
1021,"Capteur de poussières électrique, Gestion et pilotage, Ventilation, Utilités"
1022,"Remplacement des chaudières vétustes, Chaudière, Chaudière, Utilités"
1023,"Chaudières performantes à résidus de distillation, Valorisation, Déchets"
1024,"Récupération de l'eau de vache des évaporateurs, Réseau, Eau de procédés, Eau"
1025,"Récupération de la chaleur des tours de séchage, Séchage, Procédés"
1026,"Optimisation de la logistique, Gestion et pilotage, Transport, Technologies énergétiques"
1027,"Optimisation du cycle de synthèse de l'ammoniac, Gaz industriel, Procédés"
1028,"Construire un réseau de gaz naturel haute pression, Gaz industriel, Procédés"
1029,"Réparation des fuites des conduites contenant des produits chimiques, Maintenance, Procédés"
1030,"Unité d'oxygène enrichi, Gaz industriel, Procédés"
1031,"Amélioration du programme de gestion des fuites, Réseau, Vapeur, Utilités"
1032,"Turbine à contrepression, Cogénération grande taille, Cogénération"
1033,"Récupération de la chaleur des eaux perdues, Réseau, Eau Chaude Sanitaire, Eau"
1034,"Optimisation de l'apport d'oxygène grâce à une sonde CO2 liée à une régulation sur le ventilateur, Régulation, Chaudière, Utilités"
1035,"Optimisation des transferts de chaleur, Gestion et pilotage, Fours, combustion, Procédés"
1036,"Récupération de chaleur lorsque le produit se refroidit à l'air, Récupération de chaleur, Procédés"
1037,"Récupérateur de chaleur sur groupe d'eau glacée, Récupération de chaleur, Froid, Utilités"
1039,"Optimisation de la pression de fonctionnement, Cogénération grande taille, Cogénération"
1041,"Nettoyage de l'économiseur, Maintenance, Chaudière, Utilités"
1042,"Vérification de la turbine installée par rapport à sa charge, Cogénération grande taille, Cogénération"
1043,"Optimisation du circuit du réseau vapeur, Réseau, Vapeur, Utilités"
1044,"Suppression des ASI (alimentation sans interruption) redondantes, Gestion et pilotage, Distribution électrique, Utilités"
1045,"Arrêt des serveurs pendant les périodes de faible charge, Bureautique, Bâtiment"
1046,"Fonctionnement des ASI (alimentation sans interruption) en mode by-pass, Régulation, Distribution électrique, Utilités"
1047,"Isolation des courants d'air chaud et froids dans les data-centers, Récupération de chaleur, Ventilation, Utilités"
1048,"Groupe à eau glacée de haute efficacité, Centrale froid, Froid, Utilités"
1049,"Programmes de contrôle différent pour chaque groupe froid, Régulation, Froid, Utilités"
1050,"Réparation des gaines ou conduites perforées, Maintenance, Ventilation, Utilités"
1051,"Fermeture des faux plafonds pour diminuer le volume d'air conditionné., Ajustement production/besoin, Ventilation, Utilités"
1052,"Augmentation de la température de consigne de climatisation, Climatisation, CVC, Bâtiment"
1053,"Consigne de déshumidifier au strict nécessaire, Gestion et pilotage, Froid, Utilités"
1054,"Amélioration de la récupération des produits utilisés, Valorisation, Déchets"
1055,"Modification du process pour limiter la consommation énergétique, Gestion et pilotage, Procédés"
1056,"Réduction de l'utilisation de l'air comprimé et diminution des mauvais usages de l'air comprimé, Ajustement production/besoin, Air comprimé, Utilités"
1057,"Contrôle des débits d'air, Régulation, Air comprimé, Utilités"
1058,"Contrôle des conditions de fonctionnement, Traitement de l'air, Air comprimé, Utilités"
1060,"Echangeurs de pression, Ajustement production/besoin, Pompe, Utilités"
1061,"Variateur de vitesse sur compresseur d'air, Régulation, Air comprimé, Utilités"
1062,"Chauffage en toiture gaz, Chauffage, CVC, Bâtiment"
1064,"Retrofit du combustible Fioul au combustible Gaz, Gestion et pilotage, Chaudière, Utilités"
1065,"Optimisation du système de distribution, Réseau, Vapeur, Utilités"
1067,"Joints d'étanchéité et de ballet pour les portes, Etanchéité et infiltrations, Enveloppe, Bâtiment"
1068,"Réduction de la consommation des distributeurs de confiseries et boissons, Bureautique, Bâtiment"
1070,"Moteur à haut rendement IE3 (premium), Moteur, Moteur, Utilités"
1071,"Rénovation totale du bâtiment, Maintenance, Bâtiment"
1072,"Récupération des vapeurs des produits chimiques, Gaz industriel, Procédés"
1073,"Isolation des canalisations et vannes chaudes non isolées, Réseau, Eau de procédés, Eau"
1074,"Construction sur vide sanitaire, Isolation, Enveloppe, Bâtiment"
1075,"Purge des radiateurs, Chauffage, CVC, Bâtiment"
1076,"Nettoyage des filtres à air des tours de refroidissement, Condenseur, Froid, Utilités"
1077,"Micro-cogénération, Micro/mini-cogénération, Cogénération"
1078,"Certification EN 16 001, Management (ISO 50 001)"
1080,"Radiants en remplacement de systèmes de chauffage convectif au gaz, Chauffage, CVC, Bâtiment"
1081,"Sondes CO2 pour adapter la ventilation au besoin réel, Ventilation, CVC, Bâtiment"
1082,"Chaudière d'appoint à la chaudière biomasse, Chaudière, Chaudière, Utilités"
1083,"Transport de la chaleur thermique via un réseau de chaleur, Ajustement production/besoin, Réseau de chaleur, Technologies énergétiques"
1085,"Nouvelle tour de refroidissement pour réduire l'utilisation d'eau dans le process, Production, Eau de procédés, Eau"
1087,"Réduction du taux de purge de la chaudière par un système de contrôle., Traitement de l'eau, Chaudière, Utilités"
1088,"Osmose inverse pour l'optimisation du traitement de l'eau, Traitement de l'eau, Chaudière, Utilités"
1090,"Pile à combustible pour produire de l'électricité, Hydrogène / Pile à combustible, Nouvelles énergies"
1091,"Passer à une coulée continue pour la production d'acier., Gestion et pilotage, Fours, combustion, Procédés"
1092,"Remplacement des compresseurs d'air au diesel par des compresseurs à vapeur, Compresseur, Air comprimé, Utilités"
1093,"Système de purges automatique sur les tours de refroidissement, Condenseur, Froid, Utilités"
1094,"Récupération du gaz de torche grâce à un compresseur, Torchage, Procédés"
1095,"Centrale frigorifique CO2 transcritique de type booster, Centrale froid, Froid, Utilités"
1096,"Ventilation par déplacements, Gestion et pilotage, Ventilation, Utilités"
1097,"Optimisation des niveaux de consignes des échangeurs, Echangeur thermique, Vapeur, Utilités"
1098,"Identification des équipements responsables de la consommation talon, Indicateurs et tableau de bord, Mesure et comptage d’énergie, Management (ISO 50 001)"
1099,"Toiture végétalisée ou une réserve d'eau comme tampon thermique, Isolation, Enveloppe, Bâtiment"
1100,"Arrêt des équipements chauffage situés proche de sources émettant de la chaleur, Chauffage, CVC, Bâtiment"
1101,"Optimisation des éléments chauffant infrarouge des unités de thermoformage, Circuit de puissance, Presse, Procédés"
1102,"Limitant du fonctionnement à charge partielle des anciennes chaudières, Gestion et pilotage, Chaudière, Utilités"
1103,"Unités de découpe laser performantes, Gestion et pilotage, Presse, Procédés"
1104,"Optimisation de la performance énergétique des presses hydrauliques, Circuit de puissance, Presse, Procédés"
1105,"Chaudière à condensation pour le chauffage des serres horticoles, Chaudière, Chaudière, Utilités"
1107,"Ecrans thermiques latéraux, Isolation, Enveloppe, Bâtiment"
1108,"Ventilation naturelle hybride hygroréglable, Ventilation, CVC, Bâtiment"
1109,"Chauffe-bain à condensation, Production, Eau Chaude Sanitaire, Eau"
1110,"Utilisation de LED pour l’éclairage d’accentuation, Luminaire, Eclairage, Bâtiment"
1111,"Utilisation de LED de type downlight, Luminaire, Eclairage, Bâtiment"
1112,"Rééquilibrage d’une installation collective de chauffage à eau chaude, Chauffage, CVC, Bâtiment"
1113,"Aérotherme biénergies à haute efficacité énergétique, Chauffage, CVC, Bâtiment"
1114,"Système de régulation sur une installation frigorifique permettant d’avoir une basse pression flottante, Régulation, Froid, Utilités"
1116,"Sécheur à adsorption avec récupération de chaleur pour la régénération du sécheur, Traitement de l'air, Air comprimé, Utilités"
1117,"Moteur à haut rendement IE4 (super premium), Moteur, Moteur, Utilités"
1118,"Séquenceur électronique pour le pilotage d’une centrale d’air comprimé, Régulation, Air comprimé, Utilités"
1119,"Passage d’un réseau de chaleur en basse température, Production, Réseau de chaleur, Technologies énergétiques"
1120,"Renforcement du calorifuge des canalisations d’un réseau de chaleur en caniveau, Réseau, Réseau de chaleur, Technologies énergétiques"
1121,"Rénovation d’une illumination de mise en valeur, Gestion et pilotage, Eclairage, Bâtiment"
1123,"Remotorisation d’une unité de transport fluvial, Report modal, Transport, Technologies énergétiques"
1124,"Changement de catégorie de consommation des véhicules, Matériel roulant, Transport, Technologies énergétiques"
1125,"Gestion du poste pneumatique dans une flotte de poids lourds, Gestion et pilotage, Transport, Technologies énergétiques"
1126,"Gestion du poste pneumatique dans une flotte de transport de personnes, Gestion et pilotage, Transport, Technologies énergétiques"
1128,"Optimisation du réseau de chauffage, Chauffage, CVC, Bâtiment"
1129,"Cycles frigorifiques performants, Centrale froid, Froid, Utilités"
1130,"Gestion Technique Centralisée (GTC) pour le système de chauffage, Chauffage, CVC, Bâtiment"
1131,"Optimisation de l'utilisation des rideaux d'air chaud, Chauffage, CVC, Bâtiment"
1132,"Déplacement des dé-stratificateurs d'air, Chauffage, CVC, Bâtiment"
1133,"Optimisation de l'emplacement des sondes de température, Chauffage, CVC, Bâtiment"
1134,"Lampes à LED pour l'éclairage extérieur, Luminaire, Eclairage, Bâtiment"
1135,"Vérins, venturis, électrovannes et systèmes muti-pression performants, Réseau, Air comprimé, Utilités"
1136,"Recyclage de l'air intérieur des cabines de peinture, Gestion et pilotage, Peinture, Procédés"
1137,"Technologies de rupture pour sécher ou cuire la peinture, Cabine de peinture, Peinture, Procédés"
1138,"Optimisation de la température de la cabine de peinture grâce à un régulateur d’hygrométrie de l’air, Gestion et pilotage, Peinture, Procédés"
1139,"Récupérateur de chaleur sur l'air extrait des cabines de peinture, Récupération de chaleur, Peinture, Procédés"
1140,"Variateur de vitesse sur presse à injecter, Gestion et pilotage, Presse, Procédés"
1141,"Arrêt optimisé des lignes de production et de conditionnement, Gestion et pilotage, Procédés"
1142,"Optimisation de la performance énergétique des presses mécaniques, Circuit de puissance, Presse, Procédés"
1143,"Système d'extraction localisé couplé à une variation de vitesse sur le ventilateur en remplacement d'une extraction continue, Ajustement production/besoin, Ventilation, Utilités"
1144,"Dimensionnement optimal du moteur principal de l'extrudeur, Circuit de puissance, Presse, Procédés"
1445,"Variation électronique de vitesse sur un compresseur frigorifique, Régulation, Froid, Utilités"
1446,"Panneau solaire photovoltaïque monocristallin, sans tracker, raccordé au réseau, Capteur, Solaire photovoltaïque, Nouvelles énergies"
1447,"Panneau solaire photovoltaïque monocristallin, sans tracker, isolé du réseau, Capteur, Solaire photovoltaïque, Nouvelles énergies"
1448,"Panneau solaire photovoltaïque monocristallin, avec tracker 1 axe, raccordé au réseau, Capteur, Solaire photovoltaïque, Nouvelles énergies"
1449,"Panneau solaire photovoltaïque monocristallin, avec tracker 1 axe, isolé du réseau, Capteur, Solaire photovoltaïque, Nouvelles énergies"
1450,"Panneau solaire photovoltaïque monocristallin, avec tracker 2 axes, raccordé au réseau, Capteur, Solaire photovoltaïque, Nouvelles énergies"
1451,"Panneau solaire photovoltaïque monocristallin, avec tracker 2 axes, isolé du réseau, Capteur, Solaire photovoltaïque, Nouvelles énergies"
1452,"Panneau solaire photovoltaïque polycristallin, sans tracker, raccordé au réseau, Capteur, Solaire photovoltaïque, Nouvelles énergies"
1453,"Panneau solaire photovoltaïque polycristallin, sans tracker, isolé du réseau, Capteur, Solaire photovoltaïque, Nouvelles énergies"
1454,"Panneau solaire photovoltaïque polycristallin, avec tracker 1 axe, raccordé au réseau, Capteur, Solaire photovoltaïque, Nouvelles énergies"
1455,"Panneau solaire photovoltaïque polycristallin, avec tracker 1 axe, isolé du réseau, Capteur, Solaire photovoltaïque, Nouvelles énergies"
1456,"Panneau solaire photovoltaïque polycristallin, avec tracker 2 axes, raccordé au réseau, Capteur, Solaire photovoltaïque, Nouvelles énergies"
1457,"Panneau solaire photovoltaïque polycristallin, avec tracker 2 axes, isolé du réseau, Capteur, Solaire photovoltaïque, Nouvelles énergies"
1458,"Eolienne à axe vertical, Production, Eolien, Nouvelles énergies"
1459,"Petite éolienne à axe horizontal, Production, Eolien, Nouvelles énergies"
1460,"Eolienne de moyenne puissance à axe horizontal, Production, Eolien, Nouvelles énergies"
1461,"Grande éolienne à axe horizontal, Production, Eolien, Nouvelles énergies"
1462,"Micro-cogénération avec moteur à combustion interne, Micro/mini-cogénération, Cogénération"
1463,"Micro-cogénération avec micro turbine, Micro/mini-cogénération, Cogénération"
1464,"Valorisation du biogaz par cogénération, Valorisation, Méthanisation / Biogaz, Nouvelles énergies"
1465,"Valorisation du biogaz par électricité seulement, Valorisation, Méthanisation / Biogaz, Nouvelles énergies"
1466,"Valorisation du biogaz par la production de chaleur seulement, Valorisation, Méthanisation / Biogaz, Nouvelles énergies"
1467,"Injection du biogaz épuré dans le réseau, Valorisation, Méthanisation / Biogaz, Nouvelles énergies"
1468,"Récupération des matières premières rejetées, Tri, Déchets"
1469,"Valorisation financière des déchets, Tri, Déchets"
1470,"Filtres pour récupérer les poussières, Tri, Déchets"
1471,"Création d'une zone pour le tri des déchets, Tri, Déchets"
1472,"Presse pour compacter les déchets, Tri, Déchets"
1473,"Recyclage des palettes de bois, Valorisation, Déchets"
1474,"Revalorisation des résidus de bois et des sciures issus de l'industrie, Valorisation, Déchets"
1475,"Amélioration de la durée de vie des produits chimiques, Valorisation, Déchets"
1476,"Régulateurs pour les pulvérisateurs d'eau, Production, Eau de procédés, Eau"
1477,"Régulateurs de débits, Production, Eau de procédés, Eau"
1478,"Intégration d'un système de recirculation de l'eau, Réseau, Eau de procédés, Eau"
1479,"Réutilisation des eaux usées dans les procédés, Production, Eau de procédés, Eau"
1480,"Modification des systèmes d'approvisionnement et de distribution d'azote, Four, Fours, combustion, Procédés"
1481,"Protection des produits et matériaux contre les intempéries, Séchage, Procédés"
1482,"Implantation d'une serre à proximité d'une source de chaleur résiduelle, Récupération de chaleur, Procédés"
1483,"Réservoir d'hydroaccumulation de chaleur, Stockage d'énergie, Technologies énergétiques"
1484,"Audit énergétique dans l'industrie, Audit énergétique, Management (ISO 50 001)"
1485,"Réduction des temps de purge, Gestion et pilotage, Fours, combustion, Procédés"
1486,"Mur solaire passif, Chauffage, CVC, Bâtiment"
1487,"Remplacement d'un four à convection par un four infrarouge, Four, Fours, combustion, Procédés"
1488,"Régulation sur les extracteurs d'air, Gestion et pilotage, Peinture, Procédés"
1489,"Préchauffage de l'eau du circuit de chauffage, Chauffage, CVC, Bâtiment"
1490,"Ventilation en cycle fermé, Gestion et pilotage, Ventilation, Utilités"
1491,"Récupérer l'énergie mécanique de moteur de test pour produire de l'électricité, Moteur, Moteur, Utilités"
1492,"Broyeurs à haute efficacité lors du remplacement du matériel, Gestion et pilotage, Presse, Procédés"
1493,"Raccord des unités fonctionnant sur des groupes électrogènes sur le réseau électrique, Gestion et pilotage, Distribution électrique, Utilités"
1494,"Convoyeur électrique en remplacement de convoyage par engins de logistique interne (camions, pelles …)., Gestion et pilotage, Transport, Technologies énergétiques"
1495,"Eco conduite des engins de logistique interne, Ecoconduite, Transport, Technologies énergétiques"
1496,"Utilisation des modes économiques et du mode ""start and stop"" des engins, Ecoconduite, Transport, Technologies énergétiques"
1497,"Modification des horaires de production d'une unité pour éviter les pics de consommation, Stratégie et politique, Organisation, Management (ISO 50 001)"
1498,"Double tube de chauffage pour serres, Chauffage, CVC, Bâtiment"
1499,"Echangeur-récupérateur de chaleur air/ air dans un bâtiment d'élevage de volailles, Récupération de chaleur, CVC, Bâtiment"
1500,"Déshumidification via système thermodynamique pour chauffage de serres, Climatisation, CVC, Bâtiment"
1501,"Luminaire avec système de contrôle pour les parties communes, Luminaire, Eclairage, Bâtiment"
1502,"Chauffe eau thermodynamique collectif à accumulation, Production, Eau Chaude Sanitaire, Eau"
1503,"Logiciel de réduction de consommation d'ordinateurs, Bureautique, Bâtiment"
1504,"Raccordement d'un bâtiment à un réseau de froid, Climatisation, CVC, Bâtiment"
1505,"Récupération de chaleur sur une tour de refroidissement, Récupération de chaleur, Chaudière, Utilités"
1506,"Presse à injecter hybride en remplacement de presse hydraulique, Circuit de puissance, Presse, Procédés"
1507,"Optimisation d'un moteur diesel, Moteur, Moteur, Utilités"
1508,"Autopartage, Ecoconduite, Transport, Technologies énergétiques"
1509,"Stockage de déchets en mode bioréacteur, Traitement, Déchets"
1510,"Valorisation du biogaz, Traitement, Déchets"
1511,"Co-incinération des déchets, Traitement, Déchets"
1522,"Pompe à chaleur haute température avec système à absorption, Récupération de chaleur, Procédés"
1534,"Optimisation du fonctionnement des extracteurs, Extracteur d'air, Ventilation de refroidissement"
1554,"Vitrage à faible émissivité / vitrage à contrôle solaire, Vitrage, Enveloppe, Bâtiment"
1555,"Triple vitrage, Vitrage, Enveloppe, Bâtiment"
1556,"Vitrage à teinte électrique / Vitrage électrochrome, Vitrage, Enveloppe, Bâtiment"
1557,"Vitrage à store intégré, Vitrage, Enveloppe, Bâtiment"
1558,"Optimisation de l'orientation des façades vitrées, Vitrage, Enveloppe, Bâtiment"
1559,"Optimisation de la phase poste minage (explosion) roulage dans les carrières, Gestion et pilotage, Transport, Technologies énergétiques"
1560,"Arrêt des locotracteurs lors de leur chargement, Report modal, Transport, Technologies énergétiques"
1561,"Récupération de l’énergie potentielle de descente des bras des engins de manutention, Matériel roulant, Transport, Technologies énergétiques"
1568,"Méthode de séchage par refroidissement lent différé : la dryération, Dryération, Séchage silo"
1571,"Ajout de rupteurs de ponts thermiques, Isolation, Enveloppe, Bâtiment"
1572,"Pare soleil végétal, Isolation, Enveloppe, Bâtiment"
1573,"Auto contrôle de l'étanchéité à l'air, Etanchéité et infiltrations, Enveloppe, Bâtiment"
1574,"Construction d'un bâtiment passif, Isolation, Enveloppe, Bâtiment"
1575,"Panneaux d'isolation sous vide, Isolation, Enveloppe, Bâtiment"
1576,"Choisir la consigne du thermostat de ventilation, Pilotage, Séchage silo"
1577,"Calculer le réchauffement de l'air dans le ventilateur, Ventilateur de refroidissement, Ventilation de refroidissement"
1578,"Evaluer les possibilités de ventilation simultanée, Ventilation multi-cellules, Ventilation de refroidissement"
1579,"Adapter la température de séchage aux caractéristiques du grain, Pilotage, Séchage silo"
1580,"Evaluer la Consommation Thermique Spécifique (CTS) du séchoir à grains, Suivi des performances, Séchage silo"
1581,"Favoriser le pré-nettoyage du grain, Colonne sécheuse, Séchage silo"
1582,"Choisir son mode de pré-stockage, Pilotage, Séchage silo"
1583,"Améliorer l’isolation de la colonne sécheuse, Colonne sécheuse, Séchage silo"
1586,"Echangeur air/eau en haut du séchoir, Séchage, Procédés"
1587,"Echangeur air/eau en haut du séchoir, Récupérateur de chaleur, Séchage silo"
1588,"Evaluer la durée de ventilation d’un palier, Suivi des performances, Ventilation de refroidissement"
1589,"Variateur de vitesse sur le ventilateur séchoir, Ventilateur séchoir, Séchage silo"
1590,"Entretien des courroies de transmission, Ventilateur séchoir, Séchage silo"
1591,"Brûleurs de gaz naturel à veine d'air en remplacement des échangeurs de vapeur, Brûleur, Séchage silo"
1593,"Entretien des courroies de transmission, Ventilateur de refroidissement, Ventilation de refroidissement"
1594,"Sous-comptage gaz, Sous-compteur gaz, Séchage silo"
1595,"Variateur de vitesse au niveau de la fosse de réception, Fosse de réception, Manutention"
1596,"Variateur de vitesse sur le cyclone, Cyclone, Aspiration et Dépoussiérage"
1597,"Fonctionnement du moteur en charge plutôt qu'à vide, Transporteur à bande, Manutention"
1598,"Chaudière biomasse, Chaudière, Séchage silo"
1599,"ETM en cycle fermé, Energie Thermique des Mers - ETM, Energies marines renouvelables, Nouvelles énergies"
1600,"ETM en cycle ouvert, Energie Thermique des Mers - ETM, Energies marines renouvelables, Nouvelles énergies"
1601,"ETM en cycle hybride, Energie Thermique des Mers - ETM, Energies marines renouvelables, Nouvelles énergies"
1602,"Eolienne offshore flottante, Eolien offshore, Energies marines renouvelables, Nouvelles énergies"
1603,"Fondations des éoliennes offshores posées, Eolien offshore, Energies marines renouvelables, Nouvelles énergies"
1604,"Hydrolienne flottante, Hydroliennes, Energies marines renouvelables, Nouvelles énergies"
1605,"Hydrolienne à flux axial, Hydroliennes, Energies marines renouvelables, Nouvelles énergies"
1606,"Colonne d'eau oscillante côtière, Energie houlomotrice, Energies marines renouvelables, Nouvelles énergies"
1607,"Colonne d'eau oscillante immergée, Energie houlomotrice, Energies marines renouvelables, Nouvelles énergies"
1608,"Houlomoteur à déferlement, Energie houlomotrice, Energies marines renouvelables, Nouvelles énergies"
1609,"Système oscillant à translation, Energie houlomotrice, Energies marines renouvelables, Nouvelles énergies"
1610,"Système oscillant à rotation ou « serpent de mer », Energie houlomotrice, Energies marines renouvelables, Nouvelles énergies"
1611,"Simple bassin de retenue, Energie marémotrice, Energies marines renouvelables, Nouvelles énergies"
1612,"Double bassin de retenue, Energie marémotrice, Energies marines renouvelables, Nouvelles énergies"
1613,"SWAC en boucle fermée, Climatisation à l'Eau Naturellement Froide (SWAC), Energies marines renouvelables, Nouvelles énergies"
1614,"SWAC en boucle ouverte, Climatisation à l'Eau Naturellement Froide (SWAC), Energies marines renouvelables, Nouvelles énergies"
1615,"Choix du fluide frigorigène, Maintenance, Utilités"
1616,"Stockage de froid par chaleur sensible, Stockage, Froid, Utilités"
1617,"Stockage de froid par chaleur latente, Stockage, Froid, Utilités"
1618,"Stockage de froid par voie termochimique, Stockage, Froid, Utilités"
1619,"Remplacer le compresseur par un éjecteur, Machines frigorifiques, Utilités"
1620,"Isolation thermique par rideau d'air, Chambre froide, Froid, Utilités"
1621,"Machine frigorifique à compression, Machines frigorifiques, Utilités"
1622,"Machine frigorifique à compression bi-étagée, Machines frigorifiques, Utilités"
1623,"Plafond rayonnant à eau chaude, Chauffage, CVC, Bâtiment"
1624,"Plafond rayonnant réversible, Chauffage, CVC, Bâtiment"
1627,"Déshumidification de l'air par groupe à absorption indirect, Climatisation, CVC, Bâtiment"
1628,"Ventilateur de plafond réversible, Ventilation, CVC, Bâtiment"
1629,"Peinture à haute efficacité énergétique, Isolation, Enveloppe, Bâtiment"
1630,"Thermofrigopompe, Récupération de chaleur, Froid, Utilités"
1631,"Garde-Corps, Appareils électriques, Bâtiment"
