Solution_ID,Text
275,"Sensibilisation du personnel de production pour signaler immédiatement au service Entretien les fuites constatées, Gestion et pilotage, Vapeur, Utilités"
276,"Chaudière à condensation, Chaudière, Chaudière, Utilités"
277,"Plancher chauffant basse température, Chauffage, CVC, Bâtiment"
279,"Réglage fixe des thermostats et des robinets thermostatiques, Chauffage, CVC, Bâtiment"
280,"Vérification et optimisation des consignes de chauffage en fonction des locaux et de leur utilisation, Chauffage, CVC, Bâtiment"
282,"Prise en compte les considérations du personnel sur les conditions d'ambiance dans lesquelles ils travaillent, Gestion et pilotage, Bâtiment"
283,"Nettoyage régulier des filtres et des surfaces de chauffe, Chauffage, CVC, Bâtiment"
285,"Dégagement des radiateurs et des surfaces de chauffe, Chauffage, CVC, Bâtiment"
286,"Vérification des robinets et des soupapes de sécurité, Chauffage, CVC, Bâtiment"
287,"Sensibilisation du personnel sur l'ouverture des fenêtres pendant la période de chauffe, Chauffage, CVC, Bâtiment"
290,"Radiateur à chaleur douce pour un chauffage central à combustible, Chauffage, CVC, Bâtiment"
291,"Isolation d'un réseau hydraulique de chauffage, Chauffage, CVC, Bâtiment"
292,"Systèmes de chauffage rayonnant couplés à des thermostats, Chauffage, CVC, Bâtiment"
293,"Remplacement des thermostats mécaniques par des thermostats électroniques, Chauffage, CVC, Bâtiment"
294,"Systèmes de chauffage rayonnant couplés à une GTC, Chauffage, CVC, Bâtiment"
295,"Chauffage et la climatisation adaptés à l'occupation des locaux, Chauffage, CVC, Bâtiment"
296,"Chaufferie biomasse dans le tertiaire, Chaudière, Chaudière, Utilités"
297,"Programmateur d'intermittence sur une chaudière existante pour un chauffage central à combustible, Régulation, Chaudière, Utilités"
298,"Optimiseur de relance pour chauffage central à combustible, Chauffage, CVC, Bâtiment"
299,"Cahier de maintenance à jour, Maintenance, Chaudière, Utilités"
300,"Plans techniques facilement accessibles, Maintenance, Chaudière, Utilités"
301,"Documents informatifs sur le matériel sujet à des réglages simples facilement accessible, Maintenance, Chaudière, Utilités"
302,"Vérification du bon état de la ventilation, Maintenance, Chaudière, Utilités"
304,"Utilisation de la plus petite chaudière quand les besoins sont les plus faibles pour maximiser la charge, Gestion et pilotage, Chaudière, Utilités"
305,"Arrêt des chaudières dédiées au chauffage des locaux en été, Gestion et pilotage, Chaudière, Utilités"
306,"Vérification de la régulation lorsque les chaudières sont à l'arrêt, Gestion et pilotage, Chaudière, Utilités"
307,"Adoucissement de l'eau de ville du circuit chauffage, Traitement de l'eau, Chaudière, Utilités"
308,"Démarrage en cascade des chaudières, Régulation, Chaudière, Utilités"
309,"Professionnel pour l'entretien annuel des chaudières, Maintenance, Chaudière, Utilités"
310,"Contrôle des performances des chaudières, Maintenance, Chaudière, Utilités"
311,"Fonctionnement des chaudières en autocontrôle ou en télésurveillance, Maintenance, Chaudière, Utilités"
312,"Utilisation optimale de la chaudière, Gestion et pilotage, Chaudière, Utilités"
314,"Vérification du débit d'eau chaude sanitaire, Production, Eau Chaude Sanitaire, Eau"
315,"Société de maintenance spécialisée sous contrat pour l'entretien, Maintenance, Chaudière, Utilités"
316,"Vérification du contrat de maintenance afin de voir s'il est adapté, Maintenance, Chaudière, Utilités"
317,"Vérification de la circulation dans les canalisations, Réseau, Pompe, Utilités"
319,"Vérification des débits de circulation primaire et secondaire, Régulation, Chaudière, Utilités"
320,"Amélioration de l'isolation des chaudières, Chaudière, Chaudière, Utilités"
321,"Isolation du réseau de distribution de chaleur, Récupération de chaleur, Chaudière, Utilités"
322,"Récupérateur de chaleur à condensation, Fumées, Chaudière, Utilités"
323,"Séparation de la production d'eau chaude et de chauffage, Production, Eau Chaude Sanitaire, Eau"
324,"Réaction face aux pannes répétées, Maintenance, Chaudière, Utilités"
325,"Récupérateur sur les fumées pour préchauffer l’air comburant, Air de combustion, Chaudière, Utilités"
327,"Analyse de la pertinence du fluide caloporteur, Gestion et pilotage, Chaudière, Utilités"
328,"Fonctionnement du moteur à pleine charge, Ajustement production/besoin, Moteur, Utilités"
329,"Rénovation du poste éclairage par l'utilisation de lampes ou ballasts de meilleure efficacité, Gestion et pilotage, Eclairage, Bâtiment"
330,"Elimination des fuites dans les lignes et vannes de gaz d'inertage et d'air comprimé, Maintenance, Chaudière, Utilités"
331,"Moteur d'efficacité standard label IE1 (EFF2), Moteur, Moteur, Utilités"
332,"Réduction de la pression de l'air comprimé au minimum requis, Gestion et pilotage, Air comprimé, Utilités"
333,"Isolation des équipements qui ne le sont pas, Maintenance, Organisation, Management (ISO 50 001)"
334,"Détecteurs de présence, Gestion et pilotage, Eclairage, Bâtiment"
335,"Utilisation d'une source lumineuse plus efficace, Luminaire, Eclairage, Bâtiment"
336,"Analyse des effluents gazeux pour ajuster correctement le ratio air/combustible, Air de combustion, Chaudière, Utilités"
337,"Programme de maintenance préventive, Maintenance, Organisation, Management (ISO 50 001)"
338,"Maintien des équipements propres, Maintenance, Organisation, Management (ISO 50 001)"
339,"Réparation des fuites dans les lignes et les vannes, Vanne, Vapeur, Utilités"
340,"Maintenance sur les machines afin d'en réduire les pertes, Maintenance, Moteur, Utilités"
341,"Réparation des fuites dans les lignes et vannes d'eau, Réseau, Eau de procédés, Eau"
342,"Formation du personnel pour éviter les pertes de temps et de production, Sensibilisation, Organisation, Management (ISO 50 001)"
343,"Plan de maintenance des brûleurs des chaudières, Maintenance, Chaudière, Utilités"
344,"Augmentation du diamètre des câbles pour diminuer des pertes par effet Joule, Régulation, Moteur, Utilités"
345,"Vérification de la puissance réactive, Condensateur, Distribution électrique, Utilités"
346,"Minimisation du fonctionnement des moteurs au ralenti ou à faible charge, Régulation, Moteur, Utilités"
347,"Réduction de la température de combustion, Fumées, Chaudière, Utilités"
348,"Augmentation du transfert de chaleur vers le procédé, Chaudière, Chaudière, Utilités"
349,"Récupération de la chaleur des fumées pour production d'eau chaude et génération de froid, Récupération de chaleur, Chaudière, Utilités"
350,"Préchauffeur d'air pour chaudière, Air de combustion, Chaudière, Utilités"
351,"Préchauffage du combustible, Récupération de chaleur, Chaudière, Utilités"
352,"Nettoyage des surfaces de transfert de chaleur, Maintenance, Chaudière, Utilités"
353,"Vérification de la correspondance entre la sortie de la combustion et les exigences en chauffage, Fumées, Chaudière, Utilités"
354,"Repositionnement de l'admission d'air du brûleur au plafond de la chaufferie, Air de combustion, Chaudière, Utilités"
355,"Brûleurs récupératifs et régénératifs, Brûleur, Chaudière, Utilités"
356,"Brûleur haut rendement micromodulant sur une chaudière de production de vapeur ou eau surchauffée, Brûleur, Chaudière, Utilités"
357,"Réduction du débit massique des gaz de combustion par une réduction de l'excès d'air, Air de combustion, Chaudière, Utilités"
358,"Régulation et contrôle des brûleurs, Brûleur, Chaudière, Utilités"
359,"Réflexion sur le choix du combustible, Gestion et pilotage, Chaudière, Utilités"
360,"Oxycombustion, Brûleur, Fours, combustion, Procédés"
361,"Réduction des pertes de chaleur par les ouvertures du four, Four, Fours, combustion, Procédés"
364,"Inspection et vérification de l'état de l'isolation, Maintenance, Chaudière, Utilités"
365,"Sensibilisation sur le coûts d'un purgeur fuyard, Purgeur, Vapeur, Utilités"
366,"Vérification des joints d'étanchéité, Réseau, Vapeur, Utilités"
367,"Calorifugeage des vannes, des robinets et des postes de détente sur un réseau vapeur, Réseau, Vapeur, Utilités"
368,"Chauffe eau solaire collectif (CESC), Production, Eau Chaude Sanitaire, Eau"
370,"Pompe à chaleur de type eau/eau, Chauffage, CVC, Bâtiment"
371,"Pompe à chaleur de type air/eau, Chauffage, CVC, Bâtiment"
373,"Gestion technique d'un bâtiment (GTB), Gestion et pilotage, Bâtiment"
374,"Programmateur d'intermittence pour un chauffage par radiateurs électriques, Chauffage, CVC, Bâtiment"
376,"Isolation d'un réseau d'eau chaude sanitaire existant, Réseau, Eau Chaude Sanitaire, Eau"
377,"Remplacement d'un climatiseur existant par un climatiseur fixe de classe A, Climatisation, CVC, Bâtiment"
378,"Programmateur d'intermittence pour les systèmes de climatisation, Climatisation, CVC, Bâtiment"
379,"Ventilation mécanique modulée proportionnelle, Ventilation, CVC, Bâtiment"
380,"Ventilation mécanique modulée à détection de présence, Ventilation, CVC, Bâtiment"
381,"Ventilation mécanique contrôlée simple flux autoréglable, Ventilation, CVC, Bâtiment"
382,"Ventilation mécanique contrôlée double flux avec échangeur, Ventilation, CVC, Bâtiment"
384,"Raccordement à un réseau de chaleur, Chauffage, CVC, Bâtiment"
385,"Mini-cogénération sans obligation d'achat, Micro/mini-cogénération, Cogénération"
386,"Circulateur à rotor noyé de classe A, Chauffage, CVC, Bâtiment"
388,"Unité autonome de traitement d'air en toiture à haute performance énergétique, Ventilation, CVC, Bâtiment"
389,"Groupe de production d'eau glacée avec condenseur sur eau, Condenseur, Froid, Utilités"
390,"Echangeur air neuf / air extrait sur centrale de traitement d'air (DOM), Ventilation, CVC, Bâtiment"
391,"Accumulateur d'eau chaude à condensation, Production, Eau Chaude Sanitaire, Eau"
392,"Système de climatisation centralisée de type DRV, Climatisation, CVC, Bâtiment"
393,"Analyse de la qualité et de la conception de l'éclairage, Gestion et pilotage, Eclairage, Bâtiment"
394,"Gestion de l'éclairage, Gestion et pilotage, Eclairage, Bâtiment"
395,"Evaluation de l'efficacité en effectuant des mesures et vérifications : M&V - Option A, Gestion et pilotage, Eclairage, Bâtiment"
396,"Evaluation de l'efficacité en effectuant des mesures et vérifications : M&V - Option B, Gestion et pilotage, Eclairage, Bâtiment"
397,"Evaluation de l'efficacité en effectuant des mesures et vérifications : M&V - Option C, Gestion et pilotage, Eclairage, Bâtiment"
398,"Evaluation de l'efficacité en effectuant des mesures et vérifications : M&V - Option D, Gestion et pilotage, Eclairage, Bâtiment"
399,"Horloge sur un dispositif d'éclairage, Régulation, Eclairage, Bâtiment"
400,"Lampes à iodures métalliques à brûleur céramique en remplacement de lampe à vapeur de mercure, Luminaire, Eclairage, Bâtiment"
403,"Nappe d'éclairage fluorescent en tube de typeT5, Luminaire, Eclairage, Bâtiment"
404,"Système de mise au repos automatique de blocs autonomes d'éclairage de sécurité (BAES), Gestion et pilotage, Eclairage, Bâtiment"
405,"Porte non chauffante à haute performance d'isolation pour armoire horizontale à froid négatif, Meuble frigorifique, Froid, Utilités"
406,"Lampe fluo-compacte de classe A, Luminaire, Eclairage, Bâtiment"
407,"Participation du personnel à l'extinction de l'éclairage en période d'inoccupation, Gestion et pilotage, Eclairage, Bâtiment"
408,"Etiquette pour l'identification des interrupteurs, Gestion et pilotage, Eclairage, Bâtiment"
411,"Extinction de la lumière des zones souvent inoccupées, Régulation, Eclairage, Bâtiment"
412,"Extinction des luminaires extérieurs quand ils ne sont pas nécessaires, Régulation, Eclairage, Bâtiment"
414,"Caches adéquats pour les luminaires, Maintenance, Eclairage, Bâtiment"
415,"Programme d'entretien ou plan de remplacement de l'éclairage, Maintenance, Eclairage, Bâtiment"
416,"Programmateurs pour le contrôle de l'allumage, Régulation, Eclairage, Bâtiment"
418,"Luminaire avec réflecteur pour l'éclairage., Luminaire, Eclairage, Bâtiment"
419,"Lampes à induction dans les zones difficile d'accès., Luminaire, Eclairage, Bâtiment"
420,"Suppression des ampoules à incandescences, Luminaire, Eclairage, Bâtiment"
421,"Commandes individualisées de l'éclairage à distance, Régulation, Eclairage, Bâtiment"
422,"Coupe-veille automatique par détection d'utilisation des appareils raccordés, Appareils électriques, Bâtiment"
423,"Coupe-veille en hébergement relié au système d'accès., Appareils électriques, Bâtiment"
424,"Transformateur à haut rendement pour l'alimentation basse tension d'un site tertiaire, Transformateur, Distribution électrique, Utilités"
425,"Système de pilotage par intermittence des centrales de traitement d'air (DOM), Ventilation, CVC, Bâtiment"
426,"Contrat de Performance Energétique (CPE), Contrat, Gestion des énergies, Management (ISO 50 001)"
427,"Connaissance approfondie de la répartition de la consommation d'énergie du site, Indicateurs et tableau de bord, Mesure et comptage d’énergie, Management (ISO 50 001)"
428,"Politique environnementale, Management (ISO 50 001)"
429,"Comité énergie interne au site pour piloter la politique énergétique du site., Stratégie et politique, Organisation, Management (ISO 50 001)"
430,"Création d'un poste de responsable énergie, Management (ISO 50 001)"
431,"Concurrence des fournisseurs d'énergies, Contrat, Gestion des énergies, Management (ISO 50 001)"
432,"Achat d'énergie mutualisé, Contrat, Gestion des énergies, Management (ISO 50 001)"
433,"Vérification des factures d'énergie, Contrat, Gestion des énergies, Management (ISO 50 001)"
435,"Liste de fournisseur d'énergie potentiels, Contrat, Gestion des énergies, Management (ISO 50 001)"
437,"Démagnétiseur sur les fours, Gestion et pilotage, Fours, combustion, Procédés"
439,"Procédure pour relever les compteurs, Appareils électriques, Bâtiment"
440,"Analyse des irrégularités du profil de production, Indicateurs et tableau de bord, Mesure et comptage d’énergie, Management (ISO 50 001)"
441,"Mesure des consommations énergétiques la nuit durant le tarif ""heures creuses"", Mesure et comptage d’énergie, Management (ISO 50 001)"
442,"Optimisation des achats selon la variation du prix du fioul, Management (ISO 50 001)"
443,"Utilisation des DJU pour analyser le chauffage., Indicateurs et tableau de bord, Mesure et comptage d’énergie, Management (ISO 50 001)"
444,"Suivi des performances de production, Indicateurs et tableau de bord, Mesure et comptage d’énergie, Management (ISO 50 001)"
445,"Comparaison des performances énergétiques avec d'autres sites industriels, Indicateurs et tableau de bord, Mesure et comptage d’énergie, Management (ISO 50 001)"
446,"Objectifs chiffrés de réduction de consommation d'énergie, Stratégie et politique, Organisation, Management (ISO 50 001)"
447,"Motivation du personnel pour trouver des idées d'économies d'énergie réalisables., Sensibilisation, Organisation, Management (ISO 50 001)"
448,"Bibliothèque des documentations constructeurs relatives aux matériels énergétiques de l'entreprise, Maintenance, Organisation, Management (ISO 50 001)"
449,"Formation du personnel à l'utilisation rationnelle de l'énergie, Management (ISO 50 001)"
450,"Communication sur les bénéfices d'une politique d'économie d'énergie, Stratégie et politique, Organisation, Management (ISO 50 001)"
451,"Unité de transport intermodal (UTI), Report modal, Transport, Technologies énergétiques"
452,"Pneus d'autobus à basse résistance au roulement, Matériel roulant, Transport, Technologies énergétiques"
453,"Télématique embarquée pour le suivi de la conduite d'un véhicule, Gestion et pilotage, Transport, Technologies énergétiques"
454,"Lubrifiant économiseur d'énergie, Maintenance, Transport, Technologies énergétiques"
455,"Suivi des consommations de carburant grâce à des cartes privatives, Gestion et pilotage, Transport, Technologies énergétiques"
456,"Pneus de véhicules légers à basse résistance au roulement., Matériel roulant, Transport, Technologies énergétiques"
457,"Unité de transport intermodal pour le transport combiné fleuve-route, Report modal, Transport, Technologies énergétiques"
458,"Wagon d'autoroute ferroviaire, Report modal, Transport, Technologies énergétiques"
459,"Acquisition d'une barge fluviale, Report modal, Transport, Technologies énergétiques"
460,"Acquisition d'un automoteur fluvial, Report modal, Transport, Technologies énergétiques"
461,"Groupe frigorifique autonome à haute efficacité énergétique pour camions, semi remorques, remorques et caisses mobiles frigorifiques, Matériel roulant, Transport, Technologies énergétiques"
462,"Groupe frigorifique non autonome à haute efficacité énergétique pour camions, semi remorques, remorques et caisses mobiles frigorifiques, Matériel roulant, Transport, Technologies énergétiques"
463,"Lubrifiant économiseur d'énergie pour des véhicules de transport de personnes ou de marchandises, Maintenance, Transport, Technologies énergétiques"
464,"Formation d'un chauffeur à l'éco-conduite, Ecoconduite, Transport, Technologies énergétiques"
466,"Covoiturage domicile -travail, Covoiturage, Transport, Technologies énergétiques"
468,"Responsable de parc de véhicules de l'entreprise, Gestion et pilotage, Transport, Technologies énergétiques"
469,"Entretien régulier des véhicules, Maintenance, Transport, Technologies énergétiques"
470,"Vérification régulière de l'usure et la pression des pneus, Maintenance, Transport, Technologies énergétiques"
471,"Analyse des différents types de déplacements professionnels des salariés, Covoiturage, Transport, Technologies énergétiques"
472,"Véhicules adaptés aux déplacements, Gestion et pilotage, Transport, Technologies énergétiques"
473,"Plan de mobilité ou un plan de déplacement entreprise, Covoiturage, Transport, Technologies énergétiques"
474,"Encouragement à l'usage des transports en commun, Covoiturage, Transport, Technologies énergétiques"
475,"Suppression des poids inutiles des véhicules quand cela est possible, Matériel roulant, Transport, Technologies énergétiques"
476,"Plan de livraison et système de gestion de remplissage des véhicules, Gestion et pilotage, Transport, Technologies énergétiques"
478,"Réduction des déplacements professionnels, Covoiturage, Transport, Technologies énergétiques"
479,"Prise en compte la consommation de carburant comme un facteur déterminant dans l'achat d'un véhicule, Matériel roulant, Transport, Technologies énergétiques"
480,"Arrêt des moteurs lors des pauses, Matériel roulant, Transport, Technologies énergétiques"
481,"Véhicule électrique, Matériel roulant, Transport, Technologies énergétiques"
482,"Etude d'optimisation de l'usage de la chaleur au sein des procédés, Gestion et pilotage, Procédés"
483,"Optimisation de la régulation des procédés thermiques et des températures de veille, Gestion et pilotage, Procédés"
484,"Vérification régulière de l'état général des process thermiques, Maintenance, Procédés"
485,"Contrôle de la performance des échangeurs, Récupération de chaleur, Procédés"
486,"Vérification de l'adéquation des cycles thermiques avec les produits, Séchage, Procédés"
487,"Formation du personnel à quantifier les coûts énergétiques, Gestion et pilotage, Procédés"
488,"Comparaison des process actuels avec des process performants, Gestion et pilotage, Procédés"
489,"Infrarouges pour chauffer, cuire, sécher, gélifier, coller de manière directe et localisé, Séchage, Procédés"
490,"Micro-ondes et hautes fréquences pour chauffer les produits., Gestion et pilotage, Fours, combustion, Procédés"
491,"Ultraviolets pour chauffer, cuire, sécher, gélifier, coller de manière directe et localisé, Séchage, Procédés"
492,"Récupération de l'énergie des buées lors du séchage de la vapeur, Récupération de chaleur, Vapeur, Utilités"
494,"Prétraitement mécanique pour les produits à forte teneur en eau., Séchage, Procédés"
495,"Concentration d'un liquide avant de le sécher, Séchage, Procédés"
496,"Chauffage par induction, Gestion et pilotage, Fours, combustion, Procédés"
497,"Bains de traitements chauffés par TIC (tubes immergés compact), Gestion et pilotage, Fours, combustion, Procédés"
500,"Optimisation et vérification des équipements, Réseau, Air comprimé, Utilités"
502,"Profil de la demande d'air comprimé, Ajustement production/besoin, Air comprimé, Utilités"
503,"Pompes à haut rendement, Pompe, Pompe, Utilités"
504,"Arrêt des ventilateurs inutiles, Régulation, Ventilation, Utilités"
505,"Captages spécifiques pour les pollutions localisées à la place d'un système de ventilation générale, Gestion et pilotage, Ventilation, Utilités"
506,"Recharge en fluide frigorigène si nécessaire, Réseau, Froid, Utilités"
507,"Régulation du débit du fluide frigoporteur, Régulation, Froid, Utilités"
508,"Arrêt des moteurs inutiles, Ajustement production/besoin, Moteur, Utilités"
509,"Identification des systèmes inefficaces, Ajustement production/besoin, Moteur, Utilités"
510,"Dimensionnement correcte de la roue à aubes, Gestion et pilotage, Pompe, Utilités"
511,"Ajustement des bagues d'étanchéité, Maintenance, Pompe, Utilités"
512,"Arrêt des pompes inutiles, Régulation, Pompe, Utilités"
513,"Gestion quotidienne du fonctionnement, Gestion et pilotage, Ventilation, Utilités"
514,"Réactance en série pour limiter les harmoniques, Gestion et pilotage, Distribution électrique, Utilités"
515,"Résoudre les problèmes liés aux coupures de courant, Gestion et pilotage, Distribution électrique, Utilités"
516,"Détection des fuites éventuelles de diélectrique, Transformateur, Distribution électrique, Utilités"
518,"Test d'isolation électrique, Transformateur, Distribution électrique, Utilités"
529,"Lave-linge domestique de classe A+, Réseau, Eau Chaude Sanitaire, Eau"
530,"Réfrigérateur domestique performant, Gestion et pilotage, Bâtiment"
531,"Luminaire avec ballast électronique pour parties communes, Luminaire, Eclairage, Bâtiment"
534,"Formation des acteurs professionnels du secteur du bâtiment aux économies d’énergie, Gestion et pilotage, Bâtiment"
535,"Ingénierie d'accompagnement des entreprises et artisans du bâtiment pour réaliser les objectifs énergétiques du Grenelle de l'environnement, Gestion et pilotage, Bâtiment"
539,"Chauffe-Eau Solaire Individuel (CESI), Production, Eau Chaude Sanitaire, Eau"
543,"Chaudière individuelle à condensation au gaz, Chauffage, CVC, Bâtiment"
544,"Chaudière collective à condensation, Chauffage, CVC, Bâtiment"
545,"Chaudière collective à condensation avec contrat assurant le maintien du rendement énergétique de la chaudière, Chauffage, CVC, Bâtiment"
546,"Chaudière individuelle de type Basse température, Chaudière, Chaudière, Utilités"
547,"Chaudière collective de type basse température, Chaudière, Chaudière, Utilités"
548,"Chaudière collective de type basse température avec contrat assurant le maintien du rendement énergétique de la chaudière, Chaudière, Chaudière, Utilités"
550,"Régulation par sonde de température extérieure, Chauffage, CVC, Bâtiment"
551,"Appareil indépendant de chauffage au bois, Chaudière, Chaudière, Utilités"
552,"Chaudière biomasse individuelle, Chaudière, Chaudière, Utilités"
553,"Chaufferie biomasse, Chaudière, Chaudière, Utilités"
554,"Chaufferie biomasse avec contrat assurant le maintien du rendement énergétique de la chaufferie, Chaudière, Chaudière, Utilités"
556,"Plancher rayonnant électrique avec dispositif de réglage automatique, Chauffage, CVC, Bâtiment"
557,"Robinet thermostatique sur radiateurs, Chauffage, CVC, Bâtiment"
558,"Programmateur d'intermittence pour un chauffage individuel à combustible, Chauffage, CVC, Bâtiment"
561,"Système de comptage individuel d'énergie de chauffage, Chauffage, CVC, Bâtiment"
562,"Chaudière individuelle à condensation au fioul, Chauffage, CVC, Bâtiment"
567,"Ventilation mécanique contrôlée, simple flux hygroréglable, Ventilation, CVC, Bâtiment"
568,"Plafond rayonnant électrique, Chauffage, CVC, Bâtiment"
569,"Pompe à chaleur de type air/air, Chauffage, CVC, Bâtiment"
570,"Surperformance énergétique pour un bâtiment neuf avec label de haute performance énergétique, Gestion et pilotage, Bâtiment"
572,"Caisson de ventilation mécanique contrôlée (VMC) à consommation réduite, Ventilation, CVC, Bâtiment"
573,"Ventilation naturelle hygroréglable, Ventilation, CVC, Bâtiment"
575,"Programmateur d'intermittence pour un chauffage individuel avec pompe à chaleur existant, Chauffage, CVC, Bâtiment"
578,"Pompe équipée d'un système de variation électronique de vitesse, Régulation, Pompe, Utilités"
582,"Système Solaire Combiné (SSC), Capteur, Solaire thermique, Nouvelles énergies"
583,"Chaudière individuelle de type micro-cogénération à moteur Stirling, Micro/mini-cogénération, Cogénération"
585,"Système de production d'eau chaude sanitaire collective de type pompe à chaleur sur capteur solaire non vitré, Production, Eau Chaude Sanitaire, Eau"
586,"Systèmes hydro-économes, Réseau, Eau Chaude Sanitaire, Eau"
697,"Lampes à sodium basse pression pour éclairage extérieur en remplacement de lampe à vapeur de mercure, Luminaire, Eclairage, Bâtiment"
698,"Bloc autonome d'éclairage de sécurité à faible consommation, Gestion et pilotage, Eclairage, Bâtiment"
